"","time","title"
"290",2021-07-14,"facebook seeks ftc chair lina khans recusal in antitrust case"
"291",2021-07-14,"facebook petitions for recusal of ftc chief, joining amazon"
"292",2021-07-14,"facebook seeks recusal of ftc chair lina khan in antitrust case"
"293",2021-07-14,"following amazons lead, facebook seeks recusal of ftc chair in antitrust case"
"294",2021-07-14,"facebook asks for ftc chair lina khan to be recused from its antitrust case"
"295",2021-07-14,"facebook says ftc chair shouldnt help decide the future of its antitrust case"
"296",2021-07-14,"facebooks satellite internet team joins amazon"
"297",2021-07-14,"facebook is bringing group experts with badges to the platform"
"298",2021-07-14,"facebook allows group admins to designate experts for their communities"
"299",2021-07-14,"big tech antitrust how google, facebook and others are faring against us lawsuits and probes"
"300",2021-07-14,"facebook groups can now designate group experts"
"301",2021-07-13,"what bidens antitrust campaign means for amazon, apple, and facebook 3 min read"
"302",2021-07-13,"mark zuckerberg has sold facebook stock almost every weekday this year"
"303",2021-07-13,"what bidens antitrust campaign means for amazon, apple, and facebook"
"304",2021-07-13,"firefox says its revamped smartblock wont break facebook login buttons anymore"
"305",2021-07-13,"authors of new book depict facebooks dilemma and its ugly truth"
"306",2021-07-12,"facebook and twitter under fire after england soccer players face racial abuse online"
"307",2021-07-12,"facebook and twitter under fire after england soccer players face racial abuse"
"308",2021-07-12,"facebook wants to court creators it could be a tough sell"
"309",2021-07-12,"whatsapp privacy policy update that gives facebook user data access criticsed by europe consumer organisation"
"310",2021-07-11,"the top wall street analysts say investors should buy facebook amd right now"
"311",2021-07-11,"this is hydrofoiling, mark zuckerbergs latest extreme sports hobby"
"312",2021-07-11,"google, facebook, and microsoft are working on ai ethics heres what your company should be doing"
"313",2021-07-10,"why you should stop using your facebook messenger app"
"314",2021-07-10,"donald trump to sue facebook, twitter, alphabet over censorship"
"315",2021-07-10,"donald trump to sue facebook, twitter, alphabet over"
"316",2021-07-09,"trump era unravels mark zuckerberg, sheryl sandbergs facebook pairing"
"317",2021-07-09,"oversight board faults facebook for handling rule on contentious content"
"318",2021-07-09,"facebook lost important rule on dangerous individuals for three years, oversight board says"
"319",2021-07-08,"instacart replaces founder as ceo with facebook exec ahead of expected ipo"
"320",2021-07-08,"instacart hires a top facebook executive as its new chief"
"321",2021-07-08,"facebooks big blue app leader, fidji simo, is leaving to take over instacart"
"322",2021-07-08,"update 2instacart taps facebook app head simo as ceo"
"323",2021-07-08,"instacart names facebook app executive simo as ceo"
"324",2021-07-08,"facebook accidentally lost a piece of its moderation policy for three years"
"325",2021-07-08,"instacart poaches facebook executive fidji simo for ceo"
"326",2021-07-08,"grocery delivery app instacart taps facebook app boss as ceo"
"327",2021-07-08,"sc says facebook has to appear before assembly panel in delhi riots probe"
"328",2021-07-08,"delhi riots facebook india head ajit mohans plea against assembly panel summons dismissed by supreme court"
"329",2021-07-08,"trump is suing mark zuckerberg and jack dorsey why they shouldnt worry"
"330",2021-07-08,"mark zuckerberg and sheryl sandbergs partnership did not survive trump"
"331",2021-07-08,"trump files lawsuits against facebook, twitter, google that are doa"
"332",2021-07-08,"trump announces anticensorship lawsuit against facebook, twitter"
"333",2021-07-08,"trump sues twitter, google and facebook alleging censorship"
"334",2021-07-08,"donald trump sues facebook, twitter, google, alleging they silence conservative opinions"
"335",2021-07-07,"trump sues facebook, twitter, google to restore socialmedia accounts"
"336",2021-07-07,"trump sues facebook, twitter, youtube for censorship"
"337",2021-07-07,"trump sues twitter, facebook, google and immediately begins fundraising off the effort"
"338",2021-07-07,"facebook leads surging social commerce market survey"
"339",2021-07-07,"trump sues google, facebook and twitter over account suspension"
"340",2021-07-07,"donald trump to sue facebook, twitter and google"
"341",2021-07-07,"facebooks new ar feature for portal lets you dress up as harry potter characters"
"342",2021-07-07,"this is the dumbest video you will ever see of mark zuckerberg"
"343",2021-07-07,"trump is suing mark zuckerberg and jack dorsey heres why they shouldnt worry"
"344",2021-07-06,"mark zuckerberg wakeboards on july 4 is it because facebook is making trilliondollar waves"
"345",2021-07-06,"july 4 facebooks trillion valuation mark zuckerberg has many reasons to celebrate"
"346",2021-07-06,"facebook, google, twitter and other tech firms could leave hong kong over doxxing bill, industry group says"
"347",2021-07-06,"these malicious apps can steal your facebook login credentials what should you do"
"348",2021-07-05,"facebook, other internet giants warn hong kong of possible exit over proposed datasharing laws1 min read"
"349",2021-07-05,"facebook, other internet giants warn hong kong of possible exit over proposed datasharing laws"
"350",2021-07-05,"google play store removes nine malicious apps that reportedly stole users facebook login credentials"
"351",2021-07-05,"heres how mark zuckerberg spent his fourth of july prepare to cringe1 min read"
"352",2021-07-05,"heres how mark zuckerberg spent his fourth of july prepare to cringe"
"353",2021-07-05,"zuckerberg posts wacky flagwaving, surfboardriding july 4 instagram video"
"354",2021-07-05,"mark zuckerberg wakeboards holding american flag as us media pans national symbol"
"355",2021-07-04,"facebook just gave 1 million oculus users a reason to quit"
"356",2021-07-03,"dutch court rejects facebooks bid to have privacy lawsuit in the netherlands dismissed"
"357",2021-07-03,"big step towards transparency it minister praises facebook, google"
"358",2021-07-03,"facebook took action over 30 million content pieces during may 15june 15 in india, shows compliance report"
"359",2021-07-03,"first compliance report by google, facebook under new it rules big step towards transparency ravi shankar prasad"
"360",2021-07-03,"facebook turns back antitrust charges but regulatory risk is rising"
"361",2021-07-02,"facebook under fire as us lawmakers press for new antitrust complaint"
"362",2021-07-02,"it rules mandate facebook, instagram take down 32 crore posts over unlawful content in a month"
"363",2021-07-02,"dont back down from facebook fight, lawmakers tell ftc"
"364",2021-07-02,"facebook confirms tests of a new antiextremism warning prompt"
"365",2021-07-02,"twitter, tiktok, google, and facebook promise to boost protections for women online"
"366",2021-07-02,"facebook, instagram take down millions of posts in compliance with it rules"
"367",2021-07-02,"facebook cloud gaming sees 15 mn users a month, expanding to more regions"
"368",2021-07-02,"facebook set to finance regional australia newspaper fund"
"369",2021-07-01,"ftc has a chance for a doover in its fiasco antitrust case against facebook, legal experts contend4 min read"
"370",2021-07-01,"ftc has a chance for a doover in its fiasco antitrust case against facebook, legal experts contend"
"371",2021-07-01,"are facebook and the other tech giants now beyond the law"
"372",2021-07-01,"florida law barring twitter, facebook bans of candidates is blocked"
"373",2021-07-01,"i saw facebook posts vaccine disinformation endangers millions in asia"
"374",2021-06-30,"facebook launches newsletter product bulletin, its substack rival"
"375",2021-06-30,"new it rules make sense, curb abuse, says facebook india chief"
"376",2021-06-30,"facebook is testing drastic changes to instagram to make it more like tiktok"
"377",2021-06-30,"facebook critics regroup in bid to reshape the digital behemoth"
"378",2021-06-30,"facebook takes on substack with newsletter tool"
"379",2021-06-30,"14 crazy facebook, instagram facts on social media day 2021"
"380",2021-06-30,"starbucks is testing out selling these popular drinks on facebook and instagram"
"381",2021-06-30,"breaking down the trilliondollar club now that facebook is a member"
"382",2021-06-30,"cramers mad money recap facebook, merck, nvidia"
"383",2021-06-30,"stock market today with jim cramer ftc still might challenge facebook"
"384",2021-06-30,"facebook officials depose before panel on issue of social media misuse"
"385",2021-06-29,"federal court dismisses complaint against facebook seeking to split firm"
"386",2021-06-29,"facebooks antitrust win doesnt put big tech stocks in the clear"
"387",2021-06-29,"facebooks former chief privacy officer chris kelly on ftc lawsuit"
"388",2021-06-29,"watch jim cramer on cathie woods bitcoin etf, facebook, united airlines"
"389",2021-06-29,"jim cramer the government isnt a reason to sell facebook or the faang stocks"
"390",2021-06-29,"jim cramer what facebook ruling means for big tech regulation"
"391",2021-06-29,"trading facebook as market cap tops 1 trillion now what"
"392",2021-06-29,"facebook, google to soon publish reports as required by new it rules"
"393",2021-06-29,"tuesday newspaper roundup covid passports, hs2, facebook, brewdog"
"394",2021-06-29,"with dismissal of antitrust suits, facebook remains the tefloncoated company2 min read"
"395",2021-06-29,"facebook hits 1 trillion in value after us antitrust case win"
"396",2021-06-29,"facebook recruits writers and jumps into newsletters with bulletin product"
"397",2021-06-29,"facebook, google, bitcoin etf, morgan stanley 5 things you must know"
"398",2021-06-29,"facebook to publish interim compliance report as per it rules on july 2"
"399",2021-06-29,"judge dismisses antitrust lawsuits against facebook"
"400",2021-06-29,"after facebooks surge, there are now 5 tech stocks worth at least 1 trillion1 min read"
"401",2021-06-29,"zuckerberg grows 51 billion richer after judge throws out ftcs antitrust case against facebook"
"402",2021-06-29,"opinion with dismissal of antitrust suits, facebook remains the tefloncoated company"
"403",2021-06-29,"facebook crosses 1 trillion mark after judge dismisses ftc antitrust suit"
"404",2021-06-29,"judge dismisses facebook antitrust suit brought by ftc"
"405",2021-06-29,"after facebooks surge, there are now 5 tech stocks worth at least 1 trillion"
"406",2021-06-29,"judge dismisses ftc antitrust complaint against facebook"
"407",2021-06-29,"facebook hits 1 trillion in value after federal court dismisses ftc antitrust complaint"
"408",2021-06-29,"facebook recruits dozens of writers and jumps into newsletters with new bulletin product"
"409",2021-06-29,"facebook closes above 1 trillion market cap for the first time"
"410",2021-06-29,"judge dismisses ftc and state antitrust complaints against facebook"
"411",2021-06-29,"sp 500, nasdaq rise to record highs to start the week led by facebook"
"412",2021-06-29,"facebook wins antitrust dismissal, surges to 1 trillion value"
"413",2021-06-28,"facebooks vr business is bigger than you think why that matters"
"414",2021-06-28,"emails show frustration over facebooks handling of election lies"
