"","time","title"
"1","2021-08-30","weapons proliferation risk in afghanistan very worrying, former saudi intel chief says"
"2","2021-08-28","microsoft updates windows 11 minimum system requirements to include older intel cpus"
"3","2021-08-28","intel agencies say covid19 not a bioweapon but dont rule out lab leak theory in probe"
"4","2021-08-27","us intel agencies split on covid origins, offer no highconfidence conclusions in new report"
"5","2021-08-27","us intel agencies split on covid origins, offer no highconfidence conclusions"
"6","2021-08-27","us intel agencies split on covid19 origins, offer no highconfidence conclusions"
"7","2021-08-26","xiaomi mi notebook 2021 series with 11th gen intel core processors launched"
"8","2021-08-26","mi notebook ultra, mi notebook pro laptops with 11th gen intel core cpus launched in india all you need to know"
"9","2021-08-25","hp spectre x360 14 2in1 laptop with up to 17hour battery, 11th gen intel core processors launched in india"
"10","2021-08-25","nvidia polaris supercomputer deal said to be neared by us as it waits for delayed intel machine"
"11","2021-08-24","intel wins defense department contract for advanced chips2 min read"
"12","2021-08-24","intel wins defense department contract for advanced chips"
"13","2021-08-24","lenovo ideapad gaming 3i laptop gets 11th gen intel core processors"
"14","2021-08-20","intel plans to source chip subcomponents from external factories, details tsmc partnerships"
"15","2021-08-19","intel ceo calls chip maker willing buyer as industry consolidates"
"16","2021-08-19","intel chip update is chance to buy amd stock, jim cramer says"
"17","2021-08-19","intel previews its alder lake chip, promises hybrid cpus for desktops and laptops"
"18","2021-08-19","intel shows off its answer to nvidias dlss, coming to arc gpus in 2022"
"19","2021-08-19","intel alder lake 12th gen core, thread director, alchemist discrete gpu architecture details announced"
"20","2021-08-19","globalfoundries reportedly files for ipo, suggesting intel acquisition isnt in the cards1 min read"
"21","2021-08-19","globalfoundries reportedly files for ipo, suggesting intel acquisition isnt in the cards"
"22","2021-08-19","chief in charge of intel before capitol riot returns to post"
"23","2021-08-18","egyptian intel chief visits israel, invites bennett to cairo"
"24","2021-08-18","realme book slim laptops with 11th gen intel core processors launched"
"25","2021-08-18","acer predator helios 300 refreshed with intel core hseries processor, up to 360hz refresh rate in india"
"26","2021-08-18","realme book slim with 11th gen intel core processors, 2k display, 11 hours battery life launched in india"
"27","2021-08-17","intel introduces arc first gaming video cards to debut in 2022"
"28","2021-08-17","intel arc brand announced for gaming gpus first discrete desktop, laptop models coming in 2022"
"29","2021-08-16","intel to launch its first gaming gpus, arc, in 2022"
"30","2021-08-14","intel ceo talks up subsidies for pricey chip plants"
"31","2021-08-13","intel discloses small stake in crypto exchange coinbase"
"32","2021-08-13","intel added new stake in coinbase stock, valued at more than 750,000"
"33","2021-08-13","intel discloses stake in coinbase stock2 min read"
"34","2021-08-13","realme book slim will have thunderbolt 4 port, could have cheaper intel core i3 model"
"35","2021-08-11","intel fails to overturn 218billion patent verdict, plans appeal"
"36","2021-08-10","hp envy laptops with 11th gen intel core processors, nvidia gpus launched"
"37","2021-08-10","hp envy 14 2021, envy 15 2021 with 11th gen intel core cpus, up to 165hour battery launched in india"
"38","2021-08-06","realme book tipped to come with intel core i5 tiger lake processor, could launch on august 18 alongside realme gt 5g"
"39","2021-08-04","intel dell technologies make acquiring ai skills more accessible"
"40","2021-08-04","intel leak reveals thunderbolt 5 could offer 80gbps usbc ports"
"41","2021-08-02","nvidia dpu intel ipu game changers or just smart nics"
"42","2021-07-30","intel announces xeon w3300 processors for workstations details here"
"43","2021-07-29","intel announces nuc 11 extreme kit desktop gaming pc starting at 1,150"
"44","2021-07-28","in first visit to intel agency, joe biden warns of cyber conflict"
"45","2021-07-27","intel sets plan to again become worlds premier chip company"
"46","2021-07-27","intel stock dips as new chip designation, production schedule revealed"
"47","2021-07-27","intel will make qualcomm chips in new foundry deal"
"48","2021-07-27","intel has a new architecture roadmap and a plan to retake its chipmaking crown in 2025"
"49","2021-07-27","intel to build qualcomm chips, aims to catch foundry rivals tsmc and samsung by 2025"
"50","2021-07-26","hp victus 16 gaming laptops with amd ryzen, intel core processors launched"
"51","2021-07-26","msi gp leopard, pulse gl, katana gf series gaming laptops with 11th gen intel core hseries cpus launched in india"
"52","2021-07-24","intel appears to be feeling the competitive heat from amd"
"53","2021-07-23","intel stock drops as signs of continued amd share gains eclipse earnings beat"
"54","2021-07-23","intel shares slump as muted 2021 forecast, margins cloud solid earnings"
"55","2021-07-23","jim cramer where intel stands among the semiconductors after earnings"
"56","2021-07-23","massive chip shortage to continue for up to 2 years, says intel ceo"
"57","2021-07-23","massive chip shortage to continue for up to twp years, says intel chief pat gelsinger"
"58","2021-07-23","intel raises sales forecast, secondhalf demand worries send shares down"
"59","2021-07-23","intel ceo says chip shortage could stretch into 2023"
"60","2021-07-23","intel ceo says global chip shortage will get worse before it gets better3 min read"
"61","2021-07-23","intel appears to be feeling the competitive heat from amd2 min read"
"62","2021-07-23","opinion intel appears to be feeling the competitive heat from amd"
"63","2021-07-23","intel ceo says global chip shortage will get worse before it gets better"
"64","2021-07-23","intel says chip shortage could drag into 2023 as outlook barely clears street view"
"65","2021-07-23","stocks making the biggest moves after hours twitter, snap, intel and more"
"66","2021-07-22","bharti airtelintel network deal to speed up 5g service rollout"
"67","2021-07-17","intel wants to buy amds old chipmaking business how weird are semiconductor mergers going to get"
"68","2021-07-16","intel ceos chipbuilding plan has a 50 billionplus price tag"
"69","2021-07-16","an intel deal for globalfoundries could either be a huge distraction or a great fit"
"70","2021-07-16","jim cramer on intel antitrust will sink globalfoundries deal"
"71","2021-07-16","intel in talks to buy globalfoundries for about 30 billion"
"72","2021-07-16","intel is in talks to buy globalfoundries for 30 billion report2 min read"
"73","2021-07-16","intel wants to buy amds old chipmaking business how weird are semiconductor mergers going to get3 min read"
"74","2021-07-16","opinion intel wants to buy amds old chipmaking business how weird are semiconductor mergers going to get"
"75","2021-07-16","intel is in talks to buy globalfoundries for 30 billion report"
"76","2021-07-16","intel explores deal to buy chip maker globalfoundries for around 30 billion"
"77","2021-07-16","intel in talks to buy globalfoundries for 30 billion report"
"78","2021-07-16","intel is reportedly in talks to buy the 30 billion foundry company amd spun off a decade ago"
"79","2021-07-15","asus chromebook flip c214, chromebook c423, more with intel celeron processors launched in india"
"80","2021-07-04","all the key announcements made by intel at international supercomputing conference"
