"","time","title"
"1",2021-09-01,"skorean stocks gain for 4th day on tech boost, strong trade data"
"2",2021-09-01,"electric vehicles and more ubs picks the green tech stocks set to outperform"
"3",2021-09-01,"japan needs a lot more tech workers can it find a place for women"
"4",2021-09-01,"microsoft partners invest india to support tech startups"
"5",2021-09-01,"maharashtra govt warms up to blockchain tech for tamperproof education certificates"
"6",2021-09-01,"telemedicine, tech prevention the future of insurance services"
"7",2021-08-30,"sp 500, nasdaq on pace to end at new records as bulls buy tech stocks in last days of august"
"8",2021-08-30,"technology stocks lift wall street as taper fears ease"
"9",2021-08-30,"us stockstechnology stocks lift wall street as taper fears ease"
"10",2021-08-30,"bharti airtel, ril, nazara tech trading strategies for stocks in news"
"11",2021-08-30,"sandhar tech jumps 13 as report suggests co supplying auto parts to tesla"
"12",2021-08-30,"chinese tech giant meituan logs another loss despite sales jump"
"13",2021-08-30,"leadingedge companies create a more sustainable future thanks to innovative tech"
"14",2021-08-30,"sp 500 and nasdaq touch intraday record highs, but dow struggles as bulls pile into tech stocks in last days of august"
"15",2021-08-30,"big tech failed at contact tracing can it do better with vaccine passports"
"16",2021-08-30,"wedbush sees tech stocks rallying into yearend here are its top picks"
"17",2021-08-30,"chinas regulatory crackdown has wiped billions off tech stocks here are the risks ahead"
"18",2021-08-30,"sp 500, nasdaq hit record highs as tech stocks climb"
"19",2021-08-30,"chinese ai firm sensetime files for hong kong ipo despite tech crackdown and us blacklist"
"20",2021-08-30,"electric vehicle opportunities invest in product, technology stocks"
"21",2021-08-30,"sp 500, nasdaq hit record highs as taper fears calm tech stocks jump"
"22",2021-08-30,"foodics expands from tech solutions to capital funding and now has ambitions in retail"
"23",2021-08-29,"these are the best cloud hosting services in 2021and other small business tech news"
"24",2021-08-29,"one in every four investment deals in middle east goes to fintech report"
"25",2021-08-28,"affirm stock skyrockets 40 on news amazon to partner with buy now, pay later fintech company"
"26",2021-08-28,"on the job what it takes to earn 80,000 as an hvac tech in corona, california"
"27",2021-08-28,"making 80k a year as an hvac technician in california"
"28",2021-08-28,"an investor with a flair for tech could push fiserv to the next level"
"29",2021-08-28,"tech stocks roundup cramer likes salesforce, zoom"
"30",2021-08-28,"chinese tech stocks brief revival is already showing signs of fatigue"
"31",2021-08-28,"chinas sensetime prepares for hong kong ipo despite tech regulations and us blacklist"
"32",2021-08-28,"affirm stock skyrockets 40 on news amazon to partner with payovertime fintech company"
"33",2021-08-28,"govt set to extend key itr filing dates amid portal tech glitches"
"34",2021-08-27,"affirm stock skyrockets 30 on news amazon to partner with buy now, pay later fintech company1 min read"
"35",2021-08-27,"affirm stock skyrockets 30 on news amazon to partner with buy now, pay later fintech company"
"36",2021-08-27,"rakesh jhunjhunwalabacked nazara tech acquires skill gaming platform openplay"
"37",2021-08-27,"china tech rally ends on report of new ipo rules alibaba group falls 39"
"38",2021-08-27,"guilfoyle marvell technology is performing well across all units and im adding shares"
"39",2021-08-27,"saudi arabia turns to biotech as it aims to export health care products"
"40",2021-08-27,"new solarpowered technology is cleaning xochimilcos canals"
"41",2021-08-27,"three technologies hotel leaders can leverage to improve customer experience and business outcomes"
"42",2021-08-27,"a race against covid how moderna and pfizerbiontech developed vaccines in record time"
"43",2021-08-27,"how moderna and pfizerbiontech developed covid vaccines in record time"
"44",2021-08-27,"china reportedly weighs ban on us ipos from tech companies with sensitive data"
"45",2021-08-27,"china reportedly weighs ban on us ipos from domestic tech companies with sensitive data"
"46",2021-08-27,"cnbc exclusive how moderna and pfizerbiontech developed vaccines in record time"
"47",2021-08-27,"china plans to ban overseas ipos for tech firms with data security risks report"
"48",2021-08-27,"china said to plan banning overseas ipos for tech firms with data security risks"
"49",2021-08-27,"beijing looks to ban chinese tech firms from foreign listings"
"50",2021-08-27,"holders technology returns to profitability in first half"
"51",2021-08-27,"southeast asia tech dealmaking booms as investors place postcovid bets"
"52",2021-08-27,"china may ban overseas ipos for tech firms with data security risks report"
"53",2021-08-27,"update 2china plans to ban overseas ipos for tech firms with data security risks source"
"54",2021-08-27,"hong kong shares end flat as insuers gains offset loss in tech stocks"
"55",2021-08-27,"the art technique that changed medical and scientific illustration"
"56",2021-08-27,"update 1china plans to ban us ipos for tech firms with data security risks source"
"57",2021-08-27,"billionairebacked stock picker says tech bubble talk is for boomers"
"58",2021-08-27,"china plans to ban us initial public offerings for dataheavy tech firms1 min read"
"59",2021-08-27,"china plans to ban us initial public offerings for dataheavy tech firms"
"60",2021-08-27,"edtech platform camp k12 raises 12 million in series a coled by matrix partners india and elevation capital"
"61",2021-08-27,"analysissoutheast asia tech dealmaking booms as investors place postcovid bets"
"62",2021-08-27,"china plans to ban us ipos for dataheavy tech firms wsj"
"63",2021-08-27,"zen technologies hits 52week high, zooms 30 in three days"
"64",2021-08-27,"incometax notices give fpis the jitters experts suspect tech glitches"
"65",2021-08-27,"china plans to ban us ipos for dataheavy tech firms"
"66",2021-08-27,"marvell technology is bullish on data centers why the stock is falling"
"67",2021-08-27,"how eruditus has carved a distinct niche for itself in edtech landscape"
"68",2021-08-27,"tech firms opening academies in riyadh a landmark move, say experts"
"69",2021-08-27,"metaverse, phygital world, onlyfans the week in tech"
"70",2021-08-26,"unitech owners operating from tihar, supreme court shifts them to mumbai"
"71",2021-08-26,"ed cracks whip on nbfcs, fintechs over highcost micro loans, shady deals"
"72",2021-08-26,"nubank brazilian fintech offers diversification"
"73",2021-08-26,"us forgives 11 billion in debt for former itt tech students"
"74",2021-08-26,"afrotech aims to diversify boards, help firms fulfill postgeorge floyd promises"
"75",2021-08-26,"how a free harvard fellowship helped launch my tech startup called sweeten"
"76",2021-08-26,"ntpc recruits allwomen tech trainee batch in an industry first"
"77",2021-08-26,"global equities stall after renewed selling in hong kong tech shares"
"78",2021-08-26,"opinion these emerging technologies could let us store solar and wind energy"
"79",2021-08-26,"sp 500s technical indicators keep flashing green"
"80",2021-08-26,"saudi biotech center to improve the health of an oildependent economy"
"81",2021-08-26,"how technology will change the role of real estate postpandemic"
"82",2021-08-26,"these emerging technologies could let us store solar and wind energy"
"83",2021-08-26,"european equities slip after renewed selling in hong kong tech shares"
"84",2021-08-26,"what every health tech startup needs to know about gdprs international clones"
"85",2021-08-26,"morgan stanley names activision blizzard a top tech pick outside of faang names"
"86",2021-08-26,"big tech to invest billions in cybersecurity infrastructure"
"87",2021-08-26,"national webmistress day 5 amazing women who changed the tech world"
"88",2021-08-26,"most valued edtech firm byjus starts twoteacher model to improve learning"
"89",2021-08-26,"china tech selloff accelerates as weak earnings spook investors"
"90",2021-08-26,"ed reveals secret underground office of unitech founders"
"91",2021-08-26,"unitech founders operating secret underground office from jail, reveals ed"
"92",2021-08-26,"cumi to acquire controlling stake in pluss advanced technologies"
"93",2021-08-26,"sta signs mou with alibaba cloud to create a technologyled, seamless travel experience"
"94",2021-08-26,"proper fintech financing derisks artisanal mining operations"
"95",2021-08-26,"sustainable materials, technology keys to future mobility"
"96",2021-08-26,"audiotechnica aths220bt budget headphones with bluetooth, 60 hours of battery life launched"
"97",2021-08-26,"china tech rally snaps as tiktok rival kuaishou falls 12"
"98",2021-08-26,"chinese tech stocks are falling again the rally is over1 min read"
"99",2021-08-26,"exford plant workerexec creates tech to avoid recalls"
"100",2021-08-26,"chinese tech stocks are falling again the rally is over"
"101",2021-08-26,"former unitech promoters were operating from tihar jail ed tells sc"
"102",2021-08-26,"hong kong stocks close lower on tech slide, evergrande warning"
"103",2021-08-26,"sandhar technologies limited announcement under regulation 30 lodrnewspaper publication"
"104",2021-08-26,"one of chinas top tech companies is donating its entire profit for last quarter"
"105",2021-08-26,"london tech firms struggle to hire as silicon valley giants scale up in the city"
"106",2021-08-26,"lateral entry for additional btech degree to enhance job prospects"
"107",2021-08-26,"man shares photo of evershrinking xbox gamerpic due to advances in tech, xbox engineering lead responds"
"108",2021-08-26,"biden and tech bosses talk cybersecurity after ransomware attacks"
"109",2021-08-26,"chinas crackdown on tech firms opens short window for indian startsups"
"110",2021-08-26,"ps5, ps5 digital edition august 26 india restock sold out in minutes, technical errors abound"
"111",2021-08-26,"cartrade tech hits new low since listing down 11 from issue price"
"112",2021-08-26,"how women can advocate for themselves in the tech industry"
"113",2021-08-26,"biden tells ceos to raise the bar on cybersecurity big tech pledges billions"
"114",2021-08-26,"hiring now specialists to fight tech frauds, data theft, ransomware"
"115",2021-08-26,"chinas tech crackdown could be music to the ears of indian startups"
"116",2021-08-26,"as electronic transactions surge, its boom time for tech fraud fighters"
"117",2021-08-26,"19,000 buyers of unitech flats to get possession in in 4 years, sc informed"
"118",2021-08-26,"china opens asias first facility to treat medical wastewater using electron beam technology"
"119",2021-08-26,"google, microsoft, more tech firms pledge billions in cybersecurity after meeting with us president"
"120",2021-08-26,"google said to tap samsung 5g modem tech for next pixel flagship"
"121",2021-08-26,"iphone 13 face id tech may work with masks, foggy eyeglasses apple reportedly testing on employees"
"122",2021-08-25,"on semiconductor agrees to buy gt advanced tech for 415 million in cash"
"123",2021-08-25,"tech startup ceo charged with allegedly cooking books to pump up unicorn valuation"
"124",2021-08-25,"how much money youd have if you invested 1,000 in the tech giant the day tim cook took over apple"
"125",2021-08-25,"pfizer, biontech seek full approval for third covid shot"
"126",2021-08-25,"sebi asks depositories to use distributed ledger technology to monitor security creation"
"127",2021-08-25,"buybacks surge in financial sector, overtaking tech this year, says bofa"
"128",2021-08-25,"joe biden discussing cybersecurity issues with leaders from tech, education and business"
"129",2021-08-25,"country now comes before profit for tech giants in xi jinpings china"
"130",2021-08-25,"private companies back healthtech startups amidst pandemic"
"131",2021-08-25,"saudi arabia launches tech initiatives to boost kingdoms global ranking and create more startups"
"132",2021-08-25,"saudi arabia announces 12bn tech initiatives, unveils first locallymade smart chips"
"133",2021-08-25,"velocys technology chosen for japan aviation fuels project"
"134",2021-08-25,"sterlite technologies ltd compliancesreg 39 3 details of loss of certificate duplicate certificate"
"135",2021-08-25,"ray dalio is wrong about chinas tech crackdown, economist says"
"136",2021-08-25,"keep pace with changing technology revenue secretary to automakers"
"137",2021-08-25,"when cancer hit, intels akanksha bilani had faith in tech"
"138",2021-08-25,"indian shares flat as financials counter tech gains"
"139",2021-08-25,"asia report markets mixed as hk tech shares give up gains"
"140",2021-08-25,"tech view britannia, bombay dyeing can jeh wadias exit drag stocks of group cos"
"141",2021-08-25,"biden to hold cybersecurity summit with tech giants, top banks, energy firms"
"142",2021-08-25,"this china skeptic concedes tech stocks are cheap as chips but warns against holding for the long term3 min read"
"143",2021-08-25,"this china skeptic concedes tech stocks are cheap as chips but warns against holding for the long term"
"144",2021-08-25,"tencent tech giant behind videogame favorites faces beijings scrutiny"
"145",2021-08-25,"tech executives to meet with biden to discuss cybersecurity"
"146",2021-08-25,"biden to host tech, finance and energy ceos for security summit at white house"
"147",2021-08-25,"chinese tech stocks in hong kong erase some gains indias sensex hits record high"
"148",2021-08-25,"how much money youd have if you invested 1,000 in the tech giant the day tim cook took over"
"149",2021-08-25,"explained what fda full approval to pfizerbiontech vaccine means"
"150",2021-08-25,"polar capital technology adds former gam investment director to board"
"151",2021-08-25,"behind every hero or villain, there is tech support"
"152",2021-08-25,"final chance to be given to unitech home buyers seeking refund to reconsider their decision sc"
"153",2021-08-25,"saudi information technology sector will hit 27 billion by 2025"
"154",2021-08-25,"financial literacy and fintech superpowers for wealth creation"
"155",2021-08-25,"otts business chambers solving industry tech needs together"
"156",2021-08-25,"evaluating technology transfer to strengthen innovation in mexico"
"157",2021-08-24,"nasdaq futures at record high as tech stocks rise"
"158",2021-08-24,"us stocksnasdaq futures at record high as tech stocks rise"
"159",2021-08-24,"asia report chinese tech plays lead markets higher"
"160",2021-08-24,"europe open shares up on us approval of pfizerbiontech vaccine"
"161",2021-08-24,"puretech in strong position despite swinging to net loss"
"162",2021-08-24,"samsung to invest 205 billion in chip, biotech expansion"
"163",2021-08-24,"chinese tech stocks are rallying cathie wood is back in the game1 min read"
"164",2021-08-24,"chinese tech stocks are rallying cathie wood is back in the game"
"165",2021-08-24,"theres a market conundrum developing that casts a shadow over risk taking bank of america technical analyst"
"166",2021-08-24,"chinese tech stocks rally as jdcom surges 15, tencent climbs nearly 9"
"167",2021-08-24,"fintech startup khatabooks valuation tops 600 mn after raising 100 mn"
"168",2021-08-24,"microsoft partners invest india to support tech startups"
"169",2021-08-24,"chinese tech shares rebound after jdcom earnings defy crackdown"
"170",2021-08-24,"skorean stocks post best day in over 3 months on tech boost, wall st rally"
"171",2021-08-24,"japanese shares end higher as tech tracks wall streets gain"
"172",2021-08-24,"skorea stocks rise more than 15 on tech boost, wall st rally"
"173",2021-08-24,"spectris to sell ndc technologies to nordson for 180m"
"174",2021-08-24,"sudarshan sukhanitechnical call, trading calls insightssubscribe"
"175",2021-08-24,"power your tradetechnical and commodity callssubscribe"
"176",2021-08-24,"stock mantra hcl technologies at 52week high, could further rally 1020 in 34 months"
"177",2021-08-24,"kabra extrusiontechnik rallies 16 as battrixx gets single largest order"
"178",2021-08-24,"what is nanotechnology and how is it impacting neuroscience"
"179",2021-08-24,"the state of the fintech union monzo, starling bank and revolut"
"180",2021-08-24,"how to invest using technical analysis to find meaning in stock charts"
"181",2021-08-24,"chinese tech stocks rally as jdcom surges 13, tencent climbs 7"
"182",2021-08-24,"fda grants full approval to pfizerbiontechs covid shot, clearing path to more vaccine mandates"
"183",2021-08-24,"should we be worried about technological progress"
"184",2021-08-24,"nasdaq ends at record as fda fully approves pfizerbiontech vaccine"
"185",2021-08-24,"tech view bajaj finserv can hit rs 20,000 bajaj finance heading towards rs 8,000"
"186",2021-08-24,"hcl tech, munich re in pact to digitalise workplace services in 40 nations"
"187",2021-08-24,"fda fully approves pfizerbiontechs vaccine, a first for a covid19 shot"
"188",2021-08-24,"fintech firm chime valued at 25 bn after 750 million funding"
"189",2021-08-24,"saudi arabia will see more fintech unicorns soon, head of kingdoms top fintech body says"
"190",2021-08-24,"ea is opening the patents for some of its accessibility tech"
"191",2021-08-24,"didi suspends uk launch plans amid china crackdown on tech firms report"
"192",2021-08-20,"wall st supported by tech, but heads for weekly losses"
"193",2021-08-20,"us stockswall st supported by tech, but heads for weekly losses"
"194",2021-08-20,"cartrade tech makes tepid debut on dstreet tumbles nearly 8 at close of trade"
"195",2021-08-20,"how the biden administration is taking on big tech3 min read"
"196",2021-08-20,"barrons on marketwatch big tech is in a perilous moment the stocks are a buy"
"197",2021-08-20,"market snapshot dow, sp 500 pop friday to cap turbulent week as tech shares score bid"
"198",2021-08-20,"amazon launches website to go on offense against congress antitrust tech bills"
"199",2021-08-20,"us stocks snapshotwall st edges higher at open on tech boost"
"200",2021-08-20,"cartrade tech makes tepid market debut tumbles nearly 8 at close of trade"
"201",2021-08-20,"changing the playbook how labor management technology can transform hospitalitys outdated labor structures"
"202",2021-08-20,"the picture for chinese tech stocks just keeps getting worse"
"203",2021-08-20,"amazon launches website to go on offensive against congress antitrust tech bills"
"204",2021-08-20,"tesla appears far ahead of competitors in autonomous tech, says loups munster"
"205",2021-08-20,"tech selloff pushes hong kong stocks into bear market"
"206",2021-08-20,"ags transact technologies files for ipo with sebi, to raise rs 800 crore"
"207",2021-08-20,"cartrade tech shares plunge 9 on debut, what should investors do"
"208",2021-08-20,"moneycontrol markets weekly how to pick stocks with strong technicals amid market volatility"
"209",2021-08-20,"ags transact tech files draft papers with sebi to raise rs 800cr via ipo"
"210",2021-08-20,"no need to panic tech charts say all is well till sensex holds 54,000"
"211",2021-08-20,"listing today cartrade tech debuts 1 below issue price at rs 1,600 per share"
"212",2021-08-20,"stocks to watch cartrade tech, hdfc bank, vodafone idea, airtel, indostar"
"213",2021-08-20,"china adopts new privacy law, sending tech stocks tanking"
"214",2021-08-20,"charles schwab survey sees astounding influx of new traders, finds tech top pick in reopening"
"215",2021-08-20,"how the biden administration is taking on big tech"
"216",2021-08-20,"china passes sweeping data privacy law, stinging tech stocks again"
"217",2021-08-20,"china passes major data protection law as tech regulatory scrutiny intensifies"
"218",2021-08-20,"investment banks still like one chinese tech stock despite beijings crackdown"
"219",2021-08-20,"china passes major data protection law as regulatory scrutiny on tech sector intensifies"
"220",2021-08-20,"guilfoyle technical problems, stinky breadth, fiscalmonetary ying yang, white house shots"
"221",2021-08-20,"mcmillan china passes personal data protection law, sends tech south again"
"222",2021-08-20,"elon musk says tesla plans robots based on its ai technology"
"223",2021-08-20,"cartrade tech makes market debut, shares list at 1 discount"
"224",2021-08-20,"how big tech is faring against us lawsuits and probes"
"225",2021-08-20,"vp bats for indigenously developing cuttingedge technologies to strengthen indias defence"
"226",2021-08-20,"mexico gains an edge in industry 40 the week in tech"
"227",2021-08-19,"baidus 1bn bond draws strong demand despite china tech crackdown"
"228",2021-08-19,"vietnam emerges as southeast asias next fintech battleground"
"229",2021-08-19,"defensives, tech stocks push wall st higher as taper fears persist"
"230",2021-08-19,"us stocksdefensives, tech stocks push wall st higher as taper fears persist"
"231",2021-08-19,"mpd chief seeks more surveillance tech, recruitment cash"
"232",2021-08-19,"tech entrepreneur reboots wedding industry after covid19 lockdown"
"233",2021-08-19,"us stocks turn mostly higher as tech shares rally"
"234",2021-08-19,"sp 500 reverses higher on session as tech stocks gain, nvidia jumps 5"
"235",2021-08-19,"credit suisse names the cheap tech stocks to buy right now"
"236",2021-08-19,"sp 500 trades higher and nasdaq rises as tech shares rebound"
"237",2021-08-19,"alibaba stock falls as beijing hits china tech sector with proposed new regulations"
"238",2021-08-19,"oyo to hire 300 tech employees over six months for multiple roles"
"239",2021-08-19,"musks ai day confronts tough questions about teslas technology"
"240",2021-08-18,"explained what is miniled display tech that apple will be offering soon"
"241",2021-08-18,"china opens asias first facility to treat medical wastewater using electron beam technology"
"242",2021-08-18,"playtech shareholders vote against finalto sale to barinboim"
"243",2021-08-18,"tencent profits jump nearly 30 as china continues historic tech crackdown"
"244",2021-08-18,"amazon is emailing sellers to warn them about congress big tech antitrust bills"
"245",2021-08-18,"5 top stock gainers for wednesday lowes, viacomcbs and pharmacyte biotech"
"246",2021-08-18,"pharmacyte biotech stock skyrockets as ceo spells out plans"
"247",2021-08-18,"institute of chemical technology campus work to begin soon"
"248",2021-08-18,"update 1playtech investors reject finalto sale to consortium led by barinboim"
"249",2021-08-18,"fintech aspiration plans to merge with a spac in 23 billion deal3 min read"
"250",2021-08-18,"big tech conferences are coming back, but smaller ones see a different path7 min read"
"251",2021-08-18,"fintech grows greener esgfocused aspiration lands 23 billion deal to go public via spac"
"252",2021-08-18,"how agtech can help break the poverty cycle in developing countries"
"253",2021-08-18,"biden administration seeks to control banking, technology, transportation to serve a woke agenda"
"254",2021-08-18,"premarket movers pharmacyte biotech, alcon, new fortress energy"
"255",2021-08-18,"fintech aspiration plans to merge with a spac in 23 billion deal"
"256",2021-08-18,"tesla faces critical technical level that could spook bulls, trader warns"
"257",2021-08-18,"tech stocks roundup cramer likes disneys buy model with disney"
"258",2021-08-18,"mcmillan chinese tech shares drop on new rules to prevent data, consumer abuse"
"259",2021-08-18,"audio technica unveils the at2040 microphone for podcast and content creators at rs 9,500"
"260",2021-08-18,"hong kong shares end higher on financials, tech boost"
"261",2021-08-18,"explained what is a metaverse is it going to be the next big technological phenom"
"262",2021-08-18,"windlas biotech hits new low since listing falls 16 against issue price"
"263",2021-08-18,"hdfc bank can rally 11 to a new high of rs 1,750, suggest tech charts"
"264",2021-08-18,"stocks to watch hdfc bank, canara bank, hal, hcl tech, meghmani finechem"
"265",2021-08-18,"integral ad science buys adtech company publica for 220 million2 min read"
"266",2021-08-18,"chip shortage keeps cios and other tech leaders scrambling4 min read"
"267",2021-08-18,"big tech conferences are coming back, but smaller ones see a different path"
"268",2021-08-18,"tsmc overtakes tencent to become asias most valuable firm amid chinas tech crackdown"
"269",2021-08-18,"americans set to spend 487 billion on tech in 2021"
"270",2021-08-18,"hdfc bank can hit a new high of rs 1,750, suggest tech charts"
"271",2021-08-18,"from lt infotech to tata elxsi, midcap it stocks lagging largecap peers"
"272",2021-08-18,"technical bluff sees uk 12month inflation dip in july"
"273",2021-08-18,"19,000 buyers of unitech flats to get possession in in 4 years"
"274",2021-08-18,"19,000 buyers of unitech flats to get possession in in 4 years, sc informed"
"275",2021-08-18,"ecommerce and fintech the perfect pandemic marriage"
"276",2021-08-18,"say goodbye to intels realsense tech by remembering its incredible demos"
"277",2021-08-17,"in the employer struggle to find workers, there may be a 12 billion fintech opportunity"
"278",2021-08-17,"dxc technology stock slips on jp morgan downgrade"
"279",2021-08-17,"scancell chooses needlefree tech for covid vaccine candidates"
"280",2021-08-17,"rategain travel technologies files draft papers with sebi to raise funds via ipo"
"281",2021-08-17,"top headlines sii buys 50 stake in vial maker china tech stocks slump"
"282",2021-08-17,"8 tech experts share their favorite network troubleshooting tools"
"283",2021-08-17,"alibaba stock heads for lowest close since october 2019 amid pressure on chinas tech sector"
"284",2021-08-17,"dxc technology stock tumbles to lead sp 500 losers, after jp morgan turns bearish"
"285",2021-08-17,"china tightens grip on its tech sector with new rules these stocks are down"
"286",2021-08-17,"keith meister doubles down on tech, media and gaming here are his top holdings"
