"","time","title"
"1139",2021-07-08,"microsofts shadowy presence in antitrust push is angering the rest of big tech"
"1140",2021-07-08,"chinas latest move is terrible news for some of its biggest tech companies"
"1141",2021-07-08,"hong kong shares lead losses in asiapacific as chinese tech stocks drop amid regulatory fears"
"1142",2021-07-08,"crackdown on chinese tech giants is backfiring on beijing, says academic"
"1143",2021-07-08,"hsbcs advice for china investors see through tech crackdown, focus on fundamentals"
"1144",2021-07-08,"hong kong shares lead losses in asiapacific as chinese tech stocks drop"
"1145",2021-07-08,"hsbc to china investors see through the tech crackdown and focus on fundamentals"
"1146",2021-07-08,"asian markets down over fed signal, china tech crackdown"
"1147",2021-07-08,"how chinas treatment of its tech giants has evolved video timeline"
"1148",2021-07-08,"medical oxygen from honeywell technology has saved 120,000 lives in india"
"1149",2021-07-08,"behind every hero or villain, there is tech support"
"1150",2021-07-08,"edtech startup testbook now has 18 lakh paid users"
"1151",2021-07-08,"startup of the week firnas aero advancing toward modern technology, one drone at a time"
"1152",2021-07-08,"new tech and minings future will prospects improve for women"
"1153",2021-07-08,"another amazonfirst gadget brand has suspiciously vanished choetech"
"1154",2021-07-07,"update 2european shares rise as commodity stocks rebound, techs jump"
"1155",2021-07-07,"european shares rise as commodity stocks rebound, techs jump"
"1156",2021-07-07,"adept technology reports resilient fullyear performance"
"1157",2021-07-07,"technical view nifty forms bullish candle, strength possible only if index sustains above 15,915"
"1158",2021-07-07,"ultratech, acc these 6 cement stocks are signalling up to 16 upside"
"1159",2021-07-07,"tesla stock isnt joining the tech rally heres why 4 min read"
"1160",2021-07-07,"tesla stock isnt joining the tech rally heres why"
"1161",2021-07-07,"wise direct listing values fintech giant at 11 billion in big win for postbrexit london"
"1162",2021-07-07,"oped technology is driving the cannabis industrys biggest growth opportunity"
"1163",2021-07-07,"house republicans lay out their antitrust agenda for tech giants"
"1164",2021-07-07,"us announces millions in funding for projects focused on wave energy tech"
"1165",2021-07-07,"ravi shankar prasad the minister who took on big tech over compliance"
"1166",2021-07-07,"how uk companies are embracing technological innovation"
"1167",2021-07-07,"global marketsstocks mostly follow crude, yields lower tech shakes it off"
"1168",2021-07-07,"clean science technology ipo opens today should you subscribe"
"1169",2021-07-07,"cash market an ascending triangle breakout trade in ultratech cement"
"1170",2021-07-07,"clean science technology ipo kicks off today should you subscribe"
"1171",2021-07-07,"nclat issues notices to lenders, piramal on 63 moons technologies plea"
"1172",2021-07-07,"altices adtech company teads files for ipo2 min read"
"1173",2021-07-07,"how covid vaccines mrna technology could help cure other diseases"
"1174",2021-07-07,"fintech giant wise is set go public in london via a rare spotifystyle listing"
"1175",2021-07-07,"fintech giant wise is set go public in a rare spotifystyle listing and it will be a big test for london"
"1176",2021-07-07,"weibo, chinas twitter rival, plans to go private amid tech crackdown in the country"
"1177",2021-07-07,"asian markets down on fears about recovery, china tech crackdown"
"1178",2021-07-07,"tech innovations help pfl bring fresh eyes to mma"
"1179",2021-07-07,"drone policy set to be relaxed as iaf goes for counterrogue tech"
"1180",2021-07-07,"ipo watch clean science technology issue opens today should you subscribe"
"1181",2021-07-07,"pentagon cancels a disputed 10 billion technology contract"
"1182",2021-07-07,"dhfl resolution nclat issues notices to lenders, piramal on 63 moons technologies plea"
"1183",2021-07-07,"ecommerce and fintech the perfect pandemic marriage"
"1184",2021-07-06,"gr infraprojects, clean science and tech ipos should you subscribe"
"1185",2021-07-06,"intense technologies ltd submission of related party transactions for the half year ended on march 31 2021"
"1186",2021-07-06,"virgin galactic stock trades more like a biotech how to profit3 min read"
"1187",2021-07-06,"virgin galactic stock trades more like a biotech how to profit"
"1188",2021-07-06,"update 1oman asks imf technical assistance for debt strategy, fiscal framework"
"1189",2021-07-06,"update 6china tech crackdown drives plunge in didi global"
"1190",2021-07-06,"oman asks imf technical assistance for debt strategy, fiscal framework imf"
"1191",2021-07-06,"fastforward invests in cannabis healthcare firm ciitech"
"1192",2021-07-06,"technical view nifty forms gravestone doji pattern, more weakness likely if it breaks 15,730"
"1193",2021-07-06,"small midcap mantra breakout on technical charts, unlock theme make this hospitality stock a hot take"
"1194",2021-07-06,"hong kong tries to ease big techs concerns over data law"
"1195",2021-07-06,"barrons didi and other uslisted chinese tech companies tumble"
"1196",2021-07-06,"panicbuying signs in tech stocks emerge on wall street tuesday despite dows 300point tumble"
"1197",2021-07-06,"didi and other uslisted chinese tech companies tumble"
"1198",2021-07-06,"facebook, google, twitter and other tech firms could leave hong kong over doxxing bill, industry group says"
"1199",2021-07-06,"nyse trader technical analysis puts the odds in your favor"
"1200",2021-07-06,"no soil no growing seasons just add water and technology"
"1201",2021-07-06,"biotech company that botched vaccines faces investor revolt"
"1202",2021-07-06,"tech giants threaten to quit hong kong over proposed data laws"
"1203",2021-07-06,"logitech mk470 slim wireless keyboard and mouse combo with slim, compact design launched in india"
"1204",2021-07-06,"global marketsasia shares volatile as china tech worries remain"
"1205",2021-07-06,"200,000 tech support scams detected in india in q1 2021 report"
"1206",2021-07-06,"kkr pursues uk companies, beijing targets uslisted tech groups"
"1207",2021-07-06,"asia opens higher, but china tech worries weigh on hong kong"
"1208",2021-07-06,"global marketsasia opens higher, but china tech worries weigh on hong kong"
"1209",2021-07-06,"skorean stocks rise on tech boost ahead of samsung elecs earnings"
"1210",2021-07-06,"market live updates indices trade in the green led by ultratech, hdfc bank midcaps outperform"
"1211",2021-07-06,"asian share markets open higher, but china tech worries weigh on hong kong"
"1212",2021-07-06,"kotak preipo aif raises rs 1,386 cr, to invest in techfocused businesses"
"1213",2021-07-06,"sharkfest 2021 highlights the role of technology in understanding and keeping safe from sharks"
"1214",2021-07-06,"indias tech minister says twitter locked him out"
"1215",2021-07-06,"fintech startup pleo valued at 17 billion, becoming europes latest unicorn"
"1216",2021-07-06,"day of reckoning is coming for highflying tech stocks, wells fargo warns"
"1217",2021-07-06,"company card startup pleo valued at 17 billion, becoming europes latest fintech unicorn"
"1218",2021-07-06,"hong kong leader dismisses big tech privacy law fears"
"1219",2021-07-06,"fintech firm pine labs closes 600 mn fundraise, eyes ipo in 18 months"
"1220",2021-07-06,"didi global saga shows chinas tech behemoths must first answer to beijing"
"1221",2021-07-06,"bharat biotechbrazil row covaxin nod under controlled conditions"
"1222",2021-07-06,"as xi eyes control of big data, chinas tech giants turn risky for global investors"
"1223",2021-07-06,"tech mahindra partners statwig for covid19 vaccine supply chain"
"1224",2021-07-06,"hyderabadbased techie develops mileage booster for vehicles to save fuel"
"1225",2021-07-06,"hong kongs new antidoxxing proposal could put tech companies at risk, says new letter"
"1226",2021-07-06,"tech firms may be forced to quit hong kong due to privacy law changes, asia industry group warns"
"1227",2021-07-05,"stock exchanges, other market infrastructure institutions liable to face penalties for tech glitches sebi"
"1228",2021-07-05,"technical view nifty forms bullish candle, experts say create long side bets above 15,900"
"1229",2021-07-05,"tech firms threaten to quit hong kong over data law plan"
"1230",2021-07-05,"chinas attack on didi widens to more tech companies why it may get worse4 min read"
"1231",2021-07-05,"antidoxxing law could force tech giants including amazon, google from hong kong, industry group warns"
"1232",2021-07-05,"new walgreens ceo sees tech enabled healthcare in future"
"1233",2021-07-05,"barrons chinas attack on didi widens to more tech companies why it may get worse"
"1234",2021-07-05,"chinas attack on didi widens to more tech companies why it may get worse"
"1235",2021-07-05,"after cracking down on didi, china probes other uslisted tech giants"
"1236",2021-07-05,"chinas tech crackdown has a new battleground data"
"1237",2021-07-05,"veteran strategist explains why he thinks chinese tech stocks are too risky"
"1238",2021-07-05,"veteran strategist david roche explains why he thinks its too risky to own chinese tech stocks"
"1239",2021-07-05,"sebi announces new rules to make bourses pay for technical glitches"
"1240",2021-07-05,"cowin goes global india makes tech open source, 142 nations show interest"
"1241",2021-07-05,"indian scientists working on developing mrna vaccine technology get grant"
"1242",2021-07-05,"hong kong stocks fall as techs weigh over didi app takedown china mixed"
"1243",2021-07-05,"sudarshan sukhanitechnical call, trading calls insightssubscribe"
"1244",2021-07-05,"power your tradetechnical and commodity callssubscribe"
"1245",2021-07-05,"what lies behind rbis unease over big tech in financial services"
"1246",2021-07-05,"stocks to watch india pesticides, hdfc, avenue supermarts, hcl tech, ongc"
"1247",2021-07-05,"china widens datasecurity probe of uslisted tech companies"
"1248",2021-07-05,"after crackdown on didi, china opens cybersecurity probes into 3 tech firms"
"1249",2021-07-05,"after crackdown on didi, china opens cybersecurity probes into 3 more tech firms"
"1250",2021-07-05,"asia markets mixed china tech shares in hong kong fall after didi app suspension"
"1251",2021-07-05,"china extends probe into uslisted tech firms after didi blow"
"1252",2021-07-05,"bytedance selling tiktoks ai technology to firms, including those in india"
"1253",2021-07-05,"bytedance selling tiktoks ai technology to companies in india"
"1254",2021-07-05,"the tech cold wars most complicated machine thats out of chinas reach"
"1255",2021-07-04,"lidartechnology maker looks to combine performance and price4 min read"
"1256",2021-07-04,"lidartechnology maker looks to combine performance and price"
"1257",2021-07-04,"logitech brio the professional webcam for people who want 4k resolution"
"1258",2021-07-04,"hottest open source technologies for software development"
"1259",2021-07-03,"is the surfside building collapse a gray swan climatechange event"
"1260",2021-07-03,"apple ipad pro could debut breathtaking iphonebeating technology"
"1261",2021-07-03,"sun valley welcomes media, tech moguls as streaming competition mounts"
"1262",2021-07-03,"enjoy these tech deals for your fourth of july weekend"
"1263",2021-07-03,"uprvunl technician, aro asst engineer cbt date released, admit card on july 5"
"1264",2021-07-03,"smart tech is not making people dumber, study suggests"
"1265",2021-07-03,"india coronavirus dispatch covaxin 778 effective, says bharat biotech"
"1266",2021-07-03,"christies arttech summit to shed light on nonfungible tokens1 min read"
"1267",2021-07-03,"master ps son leads college athletes already cashing in on the new ncaa rules with a 2 million tech deal"
"1268",2021-07-03,"when big tech stumbles, the market can fall hard these 5 funds can help"
"1269",2021-07-03,"covaxin 778 effective against symptomatic covid19 bharat biotech"
"1270",2021-07-03,"rbi red flags concerns around big tech in financial services sector"
"1271",2021-07-03,"bharat biotech says covaxin is 934 effective against severe covid19"
"1272",2021-07-03,"who were the most active vcs in spanishspeaking latam fintechs"
"1273",2021-07-03,"this face mask tech uses biosensors to detect covid19 in your breath within 90 minutes"
"1274",2021-07-02,"palantir technologies has quietly become a major spac investor"
"1275",2021-07-02,"big tech push into indias financial sector raises concerns for traditional banks, rbi says"
"1276",2021-07-02,"biel glasses spanish couple develop hightech specs to help son see"
"1277",2021-07-02,"sp 500, nasdaq hit highs as megacap techs thrive weekly review"
"1278",2021-07-02,"big tech companies will have to open russian offices if they want to advertise in the country"
"1279",2021-07-02,"microsaic upbeat on vaccine and drug technology first"
"1280",2021-07-02,"technical view nifty forming bearish belt hold pattern on weekly charts a cause of concern, say experts"
"1281",2021-07-02,"these 6 picks by technical experts can give 1050 return over the next 36 months"
"1282",2021-07-02,"va tech wabag ltd disclosure of related party transactions pursuant to regulation 239 of the securities and exchange"
"1283",2021-07-02,"digital ad opportunities and capital spur investor interest in ad tech4 min read"
"1284",2021-07-02,"i live in seattle, but its overrun with tech workers where can i move that has cheap homes and fast internet speeds"
"1285",2021-07-02,"bet on big tech in the us or china traders stake their claims"
"1286",2021-07-02,"good news for android netflix users watch top tech stories of the week"
"1287",2021-07-02,"tech giant apple preparing for expansion of mmwave iphone 13 models"
"1288",2021-07-02,"big techs push into financial sector raises concerns, says rbi"
"1289",2021-07-02,"the tech that is getting cars to drive themselves"
"1290",2021-07-02,"mnc tech centres are a fifth of indias tech sector"
"1291",2021-07-02,"big techs push into indias financial sector raises concerns, says rbi"
"1292",2021-07-02,"indian shares flat as hero motocorp, reliance offset tech losses"
"1293",2021-07-02,"route mobile surges 10 on acquisition of email technology biz from sarv"
"1294",2021-07-02,"robinhoods finra settlement highlights growing pains of fintech firms4 min read"
"1295",2021-07-02,"the founder of a 17 billion fintech on his single biggest predictor of success"
"1296",2021-07-02,"chinas crackdown on tech isnt a move to take the wings off its firms, says strategist"
"1297",2021-07-02,"chinas crackdown on tech isnt a move to take the wings off its entrepreneurs, says strategist"
"1298",2021-07-02,"the founder of a 17 billion fintech firm reveals his single biggest predictor of success"
"1299",2021-07-01,"refileanalysisus companies spend billions on stayathome tech, boding ill for office properties"
"1300",2021-07-01,"is the surfside, fla, building collapse a gray swan climatechange event"
"1301",2021-07-01,"stock market today with jim cramer big tech is small business fuel"
"1302",2021-07-01,"prominent women call for tech giants to act against online harassment"
"1303",2021-07-01,"adapting flagship exploration technologies to new realities"
"1304",2021-07-01,"america is losing out to china in the development of blockchain technology6 min read"
"1305",2021-07-01,"opinion america is losing out to china in the development of blockchain technology"
"1306",2021-07-01,"america is losing out to china in the development of blockchain technology"
"1307",2021-07-01,"analysisus companies spend billions on stayathome tech, boding ill for office properties"
"1308",2021-07-01,"sterlite technologies ltd announcement under regulation 30 lodranalyst investor meet outcome"
"1309",2021-07-01,"technical view nifty forms bearish candle, experts say traders can remain short"
"1310",2021-07-01,"new head of global accounting rulemaker expected to zero in on technical details5 min read"
"1311",2021-07-01,"zebra technologies to buy fetch robotics in warehouse automation tieup2 min read"
"1312",2021-07-01,"at mobile show, techies enjoy facetoface socialising"
"1313",2021-07-01,"french tech firm charged over libya cyberspying"
"1314",2021-07-01,"jim cramer explains how tech has fueled the future of small businesses"
"1315",2021-07-01,"smes have a chance to grow through technology are they ready"
"1316",2021-07-01,"smes have a chance to grow through technology are they"
"1317",2021-07-01,"bt offers wholesale fibre customers longterm price certainty on fttp technology"
"1318",2021-07-01,"where is nifty50 headed in 2h2021 technical experts see volatile path towards 17,000"
"1319",2021-07-01,"tech view 3 reasons why sensex nifty are failing to hit new record peaks"
"1320",2021-07-01,"putting data to work is a business challenge, not a technical one"
"1321",2021-07-01,"lidar 101 understanding lidar technology choices and their implications"
"1322",2021-07-01,"are facebook and the other tech giants now beyond the law"
"1323",2021-07-01,"amazon plans to build delivery robot tech in finland"
"1324",2021-07-01,"data present huge opportunity this decade to be indias techade pm"
"1325",2021-07-01,"saudi scientists testing cryogenic technology to freeze carbon emissions"
"1326",2021-07-01,"indian shares edge lower on tech losses auto stocks in focus"
"1327",2021-07-01,"indian shares flat as gains in auto stocks offset tech losses"
"1328",2021-07-01,"trade spotlight what should investors do with central bank, iob and pnc infratech"
"1329",2021-07-01,"israeli automotive tech matchmaker drive tlv creates new test track"
"1330",2021-07-01,"blockbuster ipo day produces big gains for uber, delta air lines and tech vcs"
"1331",2021-07-01,"the evolution of blockchain how the foundation of crypto is changing fintech"
"1332",2021-07-01,"decoded why brazilian govt is under scrutiny over bharat biotech vaccine"
"1333",2021-07-01,"iranian disinformation effort went small to stay under big techs radar"
"1334",2021-07-01,"ravi shankar prasad says big tech has to abide by india laws"
"1335",2021-07-01,"blended curriculum of business applications and technology advantage mca"
"1336",2021-07-01,"evaluating technology transfer to strengthen innovation in mexico"
"1337",2021-07-01,"strengthening tech transfer to face challenges of industry 40"
"1338",2021-06-30,"ad tech company integral ad science closes up 14 in market debut"
"1339",2021-06-30,"alzheimers breakthrough signals game changer for biotech sector"
"1340",2021-06-30,"behind every hero or villain, there is tech support"
"1341",2021-06-30,"edtech startup testbook now has 18 lakh paid users"
"1342",2021-06-30,"airtel ropes in tatas for 5g tech to counter jios march"
"1343",2021-06-30,"big tech is gearing up for a massive fight with india"
"1344",2021-06-30,"startup of the week firnas aero advancing toward modern technology, one drone at a time"
"1345",2021-06-30,"new tech and minings future will prospects improve for women"
"1346",2021-06-30,"fuel cell tech, mindfacturing valley the week in automotive"
"1347",2021-06-30,"ai, digital healthcare, cyberattacks the week in tech"
"1348",2021-06-30,"promoters of macrotech developers repay debt of rs 1,596 cr owed to company"
"1349",2021-06-30,"must discuss accountability of big tech companies, says s jaishankar"
"1350",2021-06-30,"american express partners with fintech firms to help customers find mortgages"
"1351",2021-06-30,"facial recognition tech has been widely used across the us government for years, a new report shows"
"1352",2021-06-30,"facial recognition tech has been widely used across the us government for years, a new report shows"
"1353",2021-06-30,"ad tech company integral ad science pops 18 in market debut"
"1354",2021-06-30,"ad tech company integral ad science pops 18 in market debut"
"1355",2021-06-30,"technical view nifty forms inverted hammer pattern, experts say be cautious on long side"
"1356",2021-06-30,"cipla, dr reddys labs tech charts show up to 11 upside in pharma stocks"
"1357",2021-06-30,"tech spending expected to rise as pandemic restrictions ease, economy improves3 min read"
"1358",2021-06-30,"robinhood pays record fine to finra, settling probe into options trading issues and technology outages"
"1359",2021-06-30,"options traders are fired up about fintech as big banks look for takeout targets"
"1360",2021-06-30,"american express is sending customers to fintech partners for mortgages"
"1361",2021-06-30,"cramer says this group of tech stocks not faang is his favorite right now"
"1362",2021-06-30,"big tech is gearing up for a massive fight with modis india"
"1363",2021-06-30,"detect technologies raises 12mn from accel, elevation capital, others"
"1364",2021-06-30,"hong kongs csop chases ark success with china tech etf launches"
"1365",2021-06-30,"indian shares boosted by tech stocks, set for monthly gain"
"1366",2021-06-30,"skorean stocks rise as tech heavyweights shine us jobs data eyed"
"1367",2021-06-30,"hot stocks herewhy alkem laboratories, ajanta pharma and lt infotech are shortterm buys"
"1368",2021-06-30,"megatech regulatory battles are just beginning"
"1369",2021-06-30,"big tech is booming again, and the bull run appears to be far from over"
"1370",2021-06-30,"uber is the latest tech company to rethink its returntooffice plans"
"1371",2021-06-30,"china has gone too far in clamping down on big tech that will hurt economic growth, says analyst"
"1372",2021-06-30,"chinas crackdown on big tech firms will hurt economic growth, says analyst"
"1373",2021-06-30,"big tech to spend more time fighting regulation, warns roger mcnamee"
"1374",2021-06-30,"ripe for disruption heres a look at seeds of growth in agritech sector"
"1375",2021-06-30,"how indian engineering colleges are revamping medical rd with newage tech"
"1376",2021-06-29,"us stocksbank, tech stocks propel sp 500 to new highs"
"1377",2021-06-29,"technical view nifty forms spinning top, 15,700 is the level to watch"
"1378",2021-06-29,"warehouse operators turn to wearable technology to solve workplace strains3 min read"
"1379",2021-06-29,"how covid vaccines mrna technology could help cure other diseases"
"1380",2021-06-29,"online education tech firm 2u pops on edx acquisition"
"1381",2021-06-29,"facebooks antitrust win doesnt put big tech stocks in the clear"
"1382",2021-06-29,"jim cramer what facebook ruling means for big tech regulation"
"1383",2021-06-29,"idbi intech eyes fintech firms for takeover as it expands in europe, asia"
"1384",2021-06-29,"update 1jpmorgan to buy esgfocused fintech startup openinvest"
"1385",2021-06-29,"first stage of validation for powerhouse hydrogen tech completed"
"1386",2021-06-29,"sanofi is injecting almost half a billion dollars each year into mrna tech driving pfizer, moderna covid shots"
"1387",2021-06-29,"ark fintech fund buys coinbase stock, disclosure shows"
"1388",2021-06-29,"us justice department probing google adtech practices report"
"1389",2021-06-29,"jpmorgan is buying an esg investing platform in banks third recent fintech deal"
"1390",2021-06-29,"nasdaq slips from record high as tech rally pauses, goldman boosts dow"
"1391",2021-06-29,"exela technologies and marin software join reddit meme rally"
"1392",2021-06-29,"lt technology services partners mavenir for open ran, 5g automation"
"1393",2021-06-29,"lt technology services and mavenir partner on open ran and 5g solutions"
"1394",2021-06-29,"nasdaq, sp 500 close at records as wall street turns to tech"
"1395",2021-06-29,"tesla stock remains bellwether of highgrowth tech, jim cramer says"
"1396",2021-06-29,"edtech startup upgrad set to join unicorn club with 4billion valuation"
"1397",2021-06-29,"need to invest more in research, tech to counter rogue drone ops dfi"
"1398",2021-06-29,"brokerages retain buy on pnc infratech after a robust q4, expect up to 36 upside"
"1399",2021-06-29,"after facebooks surge, there are now 5 tech stocks worth at least 1 trillion1 min read"
"1400",2021-06-29,"how technology supports workplace diversity, equity and inclusion"
"1401",2021-06-29,"after facebooks surge, there are now 5 tech stocks worth at least 1 trillion"
"1402",2021-06-29,"morgan stanley says these 6 stocks are much cheaper alternatives to big tech"
"1403",2021-06-28,"us stockstech stock rally sends nasdaq to record high"
"1404",2021-06-28,"nasdaq rises to record high as tech stocks climb, dow falls 150 points"
"1405",2021-06-28,"12 ways to ensure the tech youre creating is meaningful for users"
"1406",2021-06-28,"us stocksnasdaq at record high on a boost from tech stocks"
"1407",2021-06-28,"us open energy stocks weigh on dow jones, early tech gains boost nasdaq"
"1408",2021-06-28,"healthtech company one medical announces plan to unionize"
"1409",2021-06-28,"you dont have to be a physicist to unleash the business power of quantum tech"
"1410",2021-06-28,"new ftc chair lina khan is big techs biggest nightmare"
"1411",2021-06-28,"the empire strikes back tech giants mount defense against house antitrust bills"
"1412",2021-06-28,"indias tech minister says twitter locked him out"
"1413",2021-06-28,"nasdaq rises to record high as tech stocks climb, dow falls 200 points"
"1414",2021-06-28,"these big tech investors discuss strategies and their microsoft positions"
"1415",2021-06-28,"technical view nifty forms bearish candle, fails to hold record level"
"1416",2021-06-28,"trust in tech industry is at alltime low four ways to change that"
"1417",2021-06-28,"15 tech experts share tips to help you learn to love tech"
"1418",2021-06-28,"three ways technology is helping public transportation become more sustainable"
"1419",2021-06-28,"log in to tech stocks, nifty it can move another 58 in short term rajesh palviya of axis securities"
"1420",2021-06-28,"panama canal tackles climatechange puzzle6 min read"
"1421",2021-06-28,"how tech companies are bringing workers back to the office slowly and with social incentives"
