"","time","title"
"287",2021-08-17,"cognizant acquires hunter technical resources"
"288",2021-08-17,"final chance to be given to unitech home buyers seeking refund to reconsider their decision sc"
"289",2021-08-17,"lex in depth remittance fintechs herald a payments revolution"
"290",2021-08-17,"esg must learn from the tech bubble returns matter"
"291",2021-08-17,"update 6china steps up tech scrutiny with rules over unfair competition, critical data"
"292",2021-08-17,"sebi notifies relaxed sweat equity rules for newage technology firms"
"293",2021-08-17,"dstreet buzz 13 stocks hit new 52week high on bse tech mahindra, tcs, wipro, infosys lead"
"294",2021-08-17,"bse it index surges 12 in 4 weeks kpit, tech mahindra rally over 25"
"295",2021-08-17,"tech view can high fuel prices, weak crude spark a rally in omcs"
"296",2021-08-17,"big tech flies too much its time for these companies to practice what they preach to help stop climate change5 min read"
"297",2021-08-17,"opinion big tech flies too much its time for these companies to practice what they preach to help stop climate change"
"298",2021-08-17,"chinese tech stocks face new regulatory pressure while us futures slip"
"299",2021-08-17,"booster shots are coming biotech valuations are already injected"
"300",2021-08-17,"big tech flies too much its time for these companies to practice what they preach to help stop climate change"
"301",2021-08-17,"china tech stocks plunge again as regulators unveil new antitrust rules"
"302",2021-08-17,"this company uses technology to cut air conditioning bills"
"303",2021-08-17,"china seeks to tighten rules on unfair internet competition, sending tech shares lower"
"304",2021-08-17,"tech is shaping foods future, but traditional practices could still play a role"
"305",2021-08-17,"cathie wood hits back at michael burry, says big short investor doesnt get tech"
"306",2021-08-17,"apple still top tech name to own, wedbush analyst ives says"
"307",2021-08-17,"dow and sp end at records and growth worries dent tech shares"
"308",2021-08-17,"china tech stocks slump as nation issues draft competition rules"
"309",2021-08-17,"behind every hero or villain, there is tech support"
"310",2021-08-17,"tech scrutiny stepped up in china with rules over unfair competition, critical data"
"311",2021-08-16,"a progress report on fintechs recordbreaking year"
"312",2021-08-16,"rptus stockstech, cyclical stocks pull wall st lower as china data sours mood"
"313",2021-08-16,"pfizer, biontech seek fda clearance for covid19 booster"
"314",2021-08-16,"turkey offers additional pfizerbiontech shots amid concern over chinese vaccine"
"315",2021-08-16,"dow, sp 500 under modest pressure as big tech slumps, china data and afghanistan weigh on bulls"
"316",2021-08-16,"chinas crackdown on tech, joe bidens infrastructure package and who will succeed angela merkel"
"317",2021-08-16,"stocks make move higher but growth worries dent tech shares"
"318",2021-08-16,"pfizer, biontech submit boosterdose data to fda, see trial progress"
"319",2021-08-16,"olectra greentech to supply 50 ebuses to gujarat transport corporation"
"320",2021-08-16,"technical glitches in it portal to be sorted soon fm"
"321",2021-08-16,"finance minister says technical glitches in it portal to be sorted out soon"
"322",2021-08-16,"this is the next tech trend that other brands may follow after apple"
"323",2021-08-16,"can new mining technologies strengthen community resilience"
"324",2021-08-16,"nio stock drops after fatal crash involving selfdriving technology"
"325",2021-08-16,"windlas biotech shares settle with 116 loss to issue price in debut trade"
"326",2021-08-16,"the technologies and best practices for making quality your corporate hallmark"
"327",2021-08-16,"16 specific steps tech leaders can take to boost diversity in their teams"
"328",2021-08-16,"windlas biotech listing disappoints, exxaro tiles jumps 10 what should investors do now"
"329",2021-08-16,"singapores nanofilm tech slumps, wiping out over 460 million from billionaire founders net worth"
"330",2021-08-16,"stocks making the biggest moves in the premarket sonos, microstrategy, seagate technology and more"
"331",2021-08-16,"ubs upgrades seagate technology, says chip stock can be a standout in struggling sector"
"332",2021-08-16,"logitech g pro wireless lightweight gaming mouse with hero 25k sensor for enhanced accuracy launched in india"
"333",2021-08-16,"seeing machines guardian technology to be integrated into eroad software"
"334",2021-08-16,"windlas biotechine0h5o01029, windlas, 543329"
"335",2021-08-16,"small midcap mantra this navratna has doubled investor wealth in 2021, technicals suggest 20 upside in 23 months"
"336",2021-08-16,"windlas biotech off to a weak start, lists at 5 discount to issue price"
"337",2021-08-16,"windlas biotech lists at 5 discount to issue price"
"338",2021-08-16,"this etf will benefit from climatechange regulations3 min read"
"339",2021-08-16,"the bigger picture behind chinas tech crackdown ambition to achieve tech supremacy"
"340",2021-08-16,"barrons this etf will benefit from climatechange regulations"
"341",2021-08-16,"tech platforms to propel india car services, repair market to 25 bn"
"342",2021-08-16,"covid19 misinformation at us public forums vexes social media platforms, big tech"
"343",2021-08-15,"big tech rolls on as investors shrug off regulatory pressure"
"344",2021-08-15,"kaimrc to hold global summit for medical biotechnology in riyadh"
"345",2021-08-15,"this weeks big tech headlines on our weekly podcast"
"346",2021-08-15,"krsnaa diagnostics, windlas biotech, exxaro tiles to debut on august 16 what could be listing premium"
"347",2021-08-15,"quest softech india ltd announcement under regulation 30 lodrnewspaper publication"
"348",2021-08-15,"amc theaters to start accepting bitcoinand other small business tech news"
"349",2021-08-15,"castex technologies ltd announcement under regulation 30 lodrnewspaper publication"
"350",2021-08-15,"potato farmer provided early funding for micron technology"
"351",2021-08-14,"taking on tech ngel daz explains how data on content moderation can expose harms against marginalized users"
"352",2021-08-14,"check latest grey market premium of windlas biotech, exxaro tiles ahead of listing"
"353",2021-08-14,"fintech firm chime valued at 25 bn after 750 million funding"
"354",2021-08-14,"go read this story of tech workers who secretly work multiple remote jobs"
"355",2021-08-14,"sudarshan sukhanitechnical call, trading calls insightssubscribe"
"356",2021-08-14,"power your tradetechnical and commodity callssubscribe"
"357",2021-08-14,"july 4th special issue washington, vc its complicated civic tech by the numbers plus a new 160 million cyber fund"
"358",2021-08-14,"how to invest using technical analysis to find meaning in stock charts"
"359",2021-08-14,"the week in charts climate, chinas tech, afghanistan and more"
"360",2021-08-14,"should we be worried about technological progress"
"361",2021-08-13,"ixigo ipo le travenues technology files rs 1,600cr ipo papers with sebi"
"362",2021-08-13,"general catalysts health playbook plus genius guild for black founders and 105m for cropdusting tech"
"363",2021-08-13,"update 2fintech firm chime valued at 25 bln after 750 mln funding"
"364",2021-08-13,"this etf will benefit from climatechange regulations"
"365",2021-08-13,"disney, tech stocks lift dow, sp 500 to record highs"
"366",2021-08-13,"us stocksdisney, tech stocks lift dow, sp 500 to record highs"
"367",2021-08-13,"bharat biotechs nasal covid19 vaccine advances into next stage of trials"
"368",2021-08-13,"womenled edtech startup whiz league raises 300k in seed funding"
"369",2021-08-13,"what alibabas metoo moment means for chinas tech stocks3 min read"
"370",2021-08-13,"what alibabas metoo moment means for chinas tech stocks"
"371",2021-08-13,"big tech embraced hybrid work its more complicated for some startups"
"372",2021-08-13,"psu receives loan license to supply bharat biotechs covaxin drug substance"
"373",2021-08-13,"market intelligence platform tracxn technologies files ipo papers with sebi"
"374",2021-08-13,"this british tech entrepreneur quietly built a 1 billion fortune by never selling a share"
"375",2021-08-13,"softbankbacked argentine fintech valued at almost 25bn"
"376",2021-08-13,"bajar gupshup nifty ends at record level tech and banks gain most"
"377",2021-08-13,"the sp 500 is nearly 99 above its march 2020 low these 3 bigtech charts will tell you if things are about to unravel"
"378",2021-08-13,"bharat biotechs intranasal vaccine gets regulator nod for phase 23 trials"
"379",2021-08-13,"emerging marketsasia tech rout drags stocks lower on pandemic, crackdown worries"
"380",2021-08-13,"airbnb up on travel recovery financial technology grows in africa"
"381",2021-08-13,"hong kong shares fall as tech stocks weigh post weekly gain"
"382",2021-08-13,"sportech signs connecticut sports betting deal"
"383",2021-08-13,"lt share price hits 52week high order win from technip energies"
"384",2021-08-13,"zensar technologies shares touch 52week high on multimilliondollar contract with city of san diego"
"385",2021-08-13,"hcl technologies becomes 4th it firm to hit rs 3 trillion marketcap"
"386",2021-08-13,"lt hits record high on order win from technip energies"
"387",2021-08-13,"a new round of regulatory pressures arrive for big tech"
"388",2021-08-13,"fighters, technology pushing pfl to top of mma world"
"389",2021-08-13,"surging tech salaries become a worry for startups"
"390",2021-08-12,"us stocksbig tech lifts sp 500 to fresh record close in listless session"
"391",2021-08-12,"garware technical fibres q1 profit after tax up 806 at rs 319 crore"
"392",2021-08-12,"how aidriven technology is increasing food security, and improving the lives of farmers worldwide"
"393",2021-08-12,"how opendoor technologies can rally another 20 after earnings"
"394",2021-08-12,"covid19 pandemic bharat biotechs covaxin ready for dispatch at new plant"
"395",2021-08-12,"china steps up crackdown on insurance technology companies"
"396",2021-08-12,"biggest defi heist ever, new iphone in sight the week in tech"
"397",2021-08-12,"technology stocks push sp 500 to record high after jobless claims, inflation data"
"398",2021-08-12,"us stockstechnology stocks push sp 500 to record high after jobless claims, inflation data"
"399",2021-08-12,"xi jinpings assault on tech will change chinas trajectory"
"400",2021-08-12,"citc to host digital technology forum to highlight investment opportunities in ksa"
"401",2021-08-12,"governments must help manage the risks of fintech"
"402",2021-08-12,"eyeing 3x revenue growth in next 3 years, says atul lall of dixon technologies"
"403",2021-08-12,"powerbridge techs stock rockets on heavy volume after plans for new bitcoin, ethereum mining operations"
"404",2021-08-12,"alibaba rape allegation reveals china techs seamy side"
"405",2021-08-12,"karnataka polytechnic admission 2021 process begins"
"406",2021-08-12,"2021 will be decisive for female empowerment in fintech"
"407",2021-08-12,"hot stocks can bet on cummins india, hcl tech and kotak bank for short term heres why"
"408",2021-08-12,"chinas tech giants generate billions for investors but small businesses are being squeezed"
"409",2021-08-12,"china tech giants generate billions for investors, but squeeze small businesses"
"410",2021-08-12,"satellite mission couldnt be accomplished due to tech error isro"
"411",2021-08-12,"us lawmakers urge suspension of drone technology transfers to turkey"
"412",2021-08-11,"fintech startup acorns hires twitter executive as cfo ahead of planned spac listing2 min read"
"413",2021-08-11,"dow trades at records as cpi matches expectations, but sp 500 under pressure as tech and healthcare stocks slump"
"414",2021-08-11,"fintech startup titan launches active crypto management with 100 minimum"
"415",2021-08-11,"what olympians can teach us to attract more talent into tech"
"416",2021-08-11,"fintechs earnings bonanza coinbase and upstart report 11fold revenue growth"
"417",2021-08-11,"us tech mogul is part of a plan to buy uks largest chip plant back off china"
"418",2021-08-11,"fintech startup titan launches active crypto management for us retail investors"
"419",2021-08-11,"the hitech gears ltd intimation for 35th annual general meeting book closure and evoting dates"
"420",2021-08-11,"chinese tech firms selfcorrect to get ahead of potential regulatory fury"
"421",2021-08-11,"web summit europes biggest tech conference to be held inperson in november in lisbon"
"422",2021-08-11,"windlas biotech ipo share allotment likely to be finalised on august 11"
"423",2021-08-11,"dynamatic tech zooms 31 in 2 days after hnis buy stake in company"
"424",2021-08-11,"lumax auto technologies ltd constitution of risk management committee and formulation adoption of policies"
"425",2021-08-11,"dow and sp 500 set records as wall street follows taper talk tech falls"
"426",2021-08-10,"13 tech leaders share their favorite software development life cycle methodologies"
"427",2021-08-10,"technical, pharma subjects to be translated into hindi shah"
"428",2021-08-10,"fcauk banks branch preservation would lend advantage to fintechs"
"429",2021-08-10,"washington vs big tech lina khans battle to transform us antitrust"
"430",2021-08-10,"african ecommerce firm jumia targets tech and user growth"
"431",2021-08-10,"softbank to hold off on new investments in china amid tech crackdown"
"432",2021-08-10,"rise of flash flooding highlighted in climatechange report"
"433",2021-08-10,"dow and sp 500 set records as wall street follows taper talk tech sector slides"
"434",2021-08-10,"crackdown on edtech firms will chinas loss be indias gain"
"435",2021-08-10,"how this technical analyst approaches wish stock"
"436",2021-08-10,"fcauk banks branch preservation would lend to fintech advantage"
"437",2021-08-10,"cartrade tech ipo retail portion booked 153 times, issue subscribed 99 on day 2"
"438",2021-08-10,"integral ad science buys adtech company publica for 220 million2 min read"
"439",2021-08-10,"how austin can compete with san francisco for the future of tech"
"440",2021-08-10,"pharmacyte biotechs stock loses more than half its value ahead of nasdaq debut"
"441",2021-08-10,"softbank unit behind risky multibilliondollar tech bets dumps shares in us tech giants"
"442",2021-08-10,"robinhood stock gains on 140 million say technologies takeover deal"
"443",2021-08-10,"softbank pauses china investing as tech crackdown roils portfolio"
"444",2021-08-10,"udupibased robosoft to be part of japanbased technopro group"
"445",2021-08-10,"ini status boosts value of food technology institutes"
"446",2021-08-10,"fintech firms dominate saudi startup scene, attracting venture capitalists"
"447",2021-08-10,"blues 50 icepop mic brings subtle improvements to some logitech headsets"
"448",2021-08-10,"starship technologies delivery robots are coming to more college campuses this fall"
"449",2021-08-10,"cartrade tech ipo retail portion booked 133 times, issue subscribed 71 on day 2"
"450",2021-08-10,"chip shortage keeps cios and other tech leaders scrambling"
"451",2021-08-10,"tech investment giant softbank sees profit slumps as value of holdings suffer"
"452",2021-08-10,"equity prices undercount climatechange risks, and realestate markets are way way off, paper shows"
"453",2021-08-10,"govt okays bharat biotechs ankleshwar plant to produce covaxin minister"
"454",2021-08-10,"washington vs big tech lina khans battle to transform american antitrust"
"455",2021-08-10,"cartrade tech ipo retail portion fully booked, issue subscribed 56 on day 2"
"456",2021-08-10,"guruspeak jakera choudhury talks on how to use basic technical and fundamental screeners to make money consistently"
"457",2021-08-10,"dynamatic technologies zooms 20 as 4 equity changes hands via block deal"
"458",2021-08-10,"tech mahindra extends gains post june quarter results stock hits new high"
"459",2021-08-10,"chip shortage keeps cios and other tech leaders scrambling4 min read"
"460",2021-08-10,"stock prices undercount climatechange risks, and realestate markets are way way off, paper shows"
"461",2021-08-10,"jpmorgan picks global growth bargains from energy to tech"
"462",2021-08-10,"elon musks spacex acquires satellite startup swarm technologies"
"463",2021-08-10,"tech mahindra to cut dependence on indian talent base"
"464",2021-08-10,"spacex to acquire small satellite startup swarm technologies"
"465",2021-08-09,"update 2defensive, technology stocks power european markets to record close"
"466",2021-08-09,"there is increasingly mounting ai technical debt that is going to inevitably sink some selfdriving cars"
"467",2021-08-09,"londons tower bridge is stuck open due to a technical fault"
"468",2021-08-09,"alibaba fires employee accused of sexual assault as pressure mounts on chinese tech"
"469",2021-08-09,"parents who raise smart, wellrounded kids always avoid these 4 phrases, says tech education expert"
"470",2021-08-09,"biontech stock jumps as covid vaccine lifts profit past estimates"
"471",2021-08-09,"biontech says covid19 vaccine repeats beat devising new one for now"
"472",2021-08-09,"biontech says has supplied more than 1 billion covid vaccine doses so far"
"473",2021-08-09,"itc opts for ppps, technical collaborations to scale up social investment programmes"
"474",2021-08-09,"chinese music group pulls 1bn hong kong ipo after tech crackdown"
"475",2021-08-09,"technical view nifty forms doji pattern, rally only on a close above 16,349"
"476",2021-08-09,"stock mantra after several months of underperformance, bata india once again looks a buy on technical charts"
"477",2021-08-09,"cartrade tech ipo heres why brokerages suggest subscribing to the issue"
"478",2021-08-09,"silverpoint infratech ltd board meeting intimation for intimation of board meeting"
"479",2021-08-09,"un report says some climatechange effects may be irreversible"
"480",2021-08-09,"didi, alibaba, tencent the risks of investing in chinese tech"
"481",2021-08-09,"can you trust the solutions that ai technologies deliver with mathematical optimization, you can"
"482",2021-08-09,"biontech stock climbs earnings blew past expectations"
"483",2021-08-09,"the all new 2022 mercedeseq eqs luxury electric sedan bursts with high tech"
"484",2021-08-09,"big tech has its eyes set on the metaverse heres what that means"
"485",2021-08-09,"this company uses technology and nature to cut your air conditioning bill"
"486",2021-08-09,"asias richest man wants to build the next tech giant"
"487",2021-08-09,"southeast asias tech startups could be valued at 1 trillion by 2025, venture capital firm predicts"
"488",2021-08-09,"tech is shaping foods future, but traditional practices could still play a role"
"489",2021-08-09,"battlefield 2042 techical test how to apply, release schedule details"
"490",2021-08-09,"future fintech jumps after memestock investors trade notes"
"491",2021-08-09,"ronnie screwvalas edtech startup upgrad a unicorn valuation tops 12 bn"
"492",2021-08-09,"when technology of espionage outstrips laws ability to protect citizens"
"493",2021-08-09,"tokyo olympics from 3dat to robots, the games that went hightech"
"494",2021-08-09,"behind every hero or villain, there is tech support"
"495",2021-08-09,"uae fintech sarwa raises 15m in mubadalaled funding round"
"496",2021-08-08,"advanced enzyme technologies ltd announcement under regulation 30 lodranalyst investor meet intimation"
"497",2021-08-08,"indeed launches a more human virtual platformand other small business tech news"
"498",2021-08-08,"cartrade tech ipo opens tomorrow 10 key things to know"
"499",2021-08-08,"south korean billionaire chey taewons sk group invests 100 million in airasias fintech unit"
"500",2021-08-08,"how nuclear technologies can help reduce greenhouse gas emissions in agriculture"
"501",2021-08-08,"chinas bytedance aims for hong kong ipo despite tech crackdown"
"502",2021-08-08,"to make bets on bond market more accurate, marketaxess enlists lessons from big tech3 min read"
"503",2021-08-08,"elon musk slams apple in brazen technology rivalry"
"504",2021-08-07,"railways sets eyes on hydrogen powered trains, invites bids for new tech"
"505",2021-08-07,"railways sets eyes on hydrogen powered trains, invites bids for fuel cellbased tech"
"506",2021-08-07,"a new economic reality is weighing on tech stocks"
"507",2021-08-07,"cash glut at warren buffetts berkshire may trap tech titans next"
"508",2021-08-07,"as technology evolves, flying cars finally get ready to take off"
"509",2021-08-07,"whatsapp lead and other tech experts fire back at apples child safety plan"
"510",2021-08-06,"fermenta biotech ltd compliancesreg 39 3 details of loss of certificate duplicate certificate"
"511",2021-08-06,"technical view nifty forms bearish candle, weakness may continue amid sideways trade"
"512",2021-08-06,"retail zeal hoists ipos of devyani, windlas biotech, exxaro tiles, krsnaa diagnostics"
"513",2021-08-06,"dstreet talk ai next big thing kshitiz mahajan explores 6 companies that are using smart technology"
"514",2021-08-06,"small midcap mantra this it firm doubles wealth in 2021, technicals suggest another 20 upside in 69 months"
"515",2021-08-06,"windlas biotech ipo oversubscribed 2246 times on closing day"
"516",2021-08-06,"sebi relaxes sweat equity norms for newage technology cos"
"517",2021-08-06,"amazon vs future grp tech charts show 20 downside in future group stocks"
"518",2021-08-06,"medtech, glucose metabolism and the quest for longevity"
"519",2021-08-06,"big techs big problem let employees stay home from expensive campuses or risk losing 30 of their workers"
"520",2021-08-06,"big tech is suffering from a great resignation of workers, who say its a good time to leave"
"521",2021-08-06,"tech is shaping the future of food but practices rooted in tradition could still have a role to play"
"522",2021-08-06,"should we be worried about technological progress"
"523",2021-08-06,"tech stocks roundup cramer likes facebook, snap and roku"
"524",2021-08-06,"meisler heres why were too bullish on growth, tech"
"525",2021-08-06,"jensen is this the start of a longawaited rebound for biotech"
"526",2021-08-06,"amazon vs future group case tech charts show 20 downside in future group stocks"
"527",2021-08-06,"supporting 3 psus, bharat biotech facility for more covaxin doses govt"
"528",2021-08-06,"this game brings batman and its tech to augmented reality for kids"
"529",2021-08-06,"new bitcoin tax plans could stifle greener blockchain tech"
"530",2021-08-06,"us job growth seen strong as technical factors provide a boost"
"531",2021-08-06,"skorean stocks fall on tech slide, delta worries set for weekly gain"
"532",2021-08-06,"sudarshan sukhanitechnical call, trading calls insightssubscribe"
"533",2021-08-06,"power your tradetechnical and commodity callssubscribe"
"534",2021-08-06,"windlas biotech ipo closes today why brokers are pressing subscribe button"
"535",2021-08-06,"trade spotlight what should investors do with tech mahindra, hcl tech and sonata software"
"536",2021-08-06,"hot stocks hcl technologies, kotak mahindra bank and hdfc can give up to 24 return in short term"
"537",2021-08-06,"this week in xr brain tech nabs 50 million, 3d without glasses, more on metaverses"
"538",2021-08-06,"how to invest using technical analysis to find meaning in stock charts"
"539",2021-08-06,"jefferies reveals its tech stock picks for the rest of the year"
"540",2021-08-06,"the best tech stock to buy today is this cybersecurity stalwart"
"541",2021-08-06,"we havent had any impact of chip shortage on our business kpit tech chief"
"542",2021-08-06,"uber to hike india tech centres headcount to 1k by 2021 end"
"543",2021-08-06,"a journey into business leaders minds the week in tech"
"544",2021-08-05,"over 200 tests for every batch bharat biotech on covaxin quality concern"
"545",2021-08-05,"saarc nations for technology use to fight climate crisis in fisheries"
"546",2021-08-05,"tech gains, strong earnings power european stocks to new highs"
"547",2021-08-05,"update 2tech gains, strong earnings power european stocks to new highs"
"548",2021-08-05,"thursday newspaper roundup uber, pensions, tech floats"
"549",2021-08-05,"technical view nifty forms doji pattern, 16,210 is the level to watch"
"550",2021-08-05,"dstreet buzz over 250 stocks hit new 52week high on bse tech mahindra, wipro lead as it stocks gain"
"551",2021-08-05,"windlas biotech ipo retails investors lead charge, issue subscribed 706 times on day 2"
"552",2021-08-05,"13 tech leaders share their favorite sources of leadership lessons"
"553",2021-08-05,"three lesserknown strategies for hiring the best engineering talent in the tech industry"
"554",2021-08-05,"amazon, google and other tech companies join government effort to fight ransomware"
"555",2021-08-05,"amazon discloses investment in biotech firm nautilus"
"556",2021-08-05,"new candidate for top bank regulator sees risks in crypto and fintechs"
"557",2021-08-05,"surging tech salaries become a worry for startups"
"558",2021-08-05,"apple to use new tech to see what photos you have in your iphone"
"559",2021-08-05,"buynowpaylater fintech leads 2021 saudi venture capital financing"
"560",2021-08-05,"using technology to bridge latams financial inclusion gap"
"561",2021-08-05,"digital coins, another fintech perfect for fighting corruption"
"562",2021-08-05,"ecommerce and fintech the perfect pandemic marriage"
"563",2021-08-05,"facebook working on tech to project eyes onto vr headset"
"564",2021-08-04,"china shares rise on tech sector bounce hong kong gains"
"565",2021-08-04,"hot stocks bata india, lt and hcl technologies can give 915 return in short term"
"566",2021-08-04,"ipo alert krsnaa diagnostics, windlas biotech fit for investing"
"567",2021-08-04,"intel dell technologies make acquiring ai skills more accessible"
"568",2021-08-04,"asian markets rebound despite wariness of chinese tech stocks"
