"","time","title"
"569",2021-08-04,"china denounces online videogames why it could boost big tech stocks"
"570",2021-08-04,"why is metaverse the hottest tech buzzword apple has something to do with it"
"571",2021-08-04,"why this technical analyst is watching wish, hims, spotify"
"572",2021-08-04,"edtech giant byjus eyes 1 billion revenue in us in three years"
"573",2021-08-04,"editorial targeting tech chinese govts recent steps can backfire"
"574",2021-08-04,"new crop of niche edtech players help solve less obvious problems"
"575",2021-08-04,"could ironair batteries become the ideal storage tech"
"576",2021-08-04,"realme magdart magnetic wireless fast charging tech unveiled, includes 50w 15w chargers, wallet, more"
"577",2021-08-04,"oppo unveils its nextgeneration underscreen camera usc technology"
"578",2021-08-03,"tech stocks weigh on european shares, bp jumps on dividend boost"
"579",2021-08-03,"dalio says beijings crackdown on technology firms has been misinterpreted"
"580",2021-08-03,"flowtech fluidpower still performing below prepandemic levels"
"581",2021-08-03,"windlas biotech mobilises rs 12046 crore from 22 anchor investors ahead of ipo"
"582",2021-08-03,"technical view nifty tops 16,000 to form large bullish candle, macd gives a buy signal"
"583",2021-08-03,"windlas biotech ipo 10 key things to know before the issue opens"
"584",2021-08-03,"alibaba posts lower profit as chinese tech giant boosts spending"
"585",2021-08-03,"alibaba earnings down as china tech giants face turmoil"
"586",2021-08-03,"why foodtech is becoming relevant and why you should care"
"587",2021-08-03,"logitech zone true wireless, zone wired earbuds launched targeting video conferencing"
"588",2021-08-03,"stock mantra after doubling investor wealth in a year, nmdc is once again a buy on technical charts"
"589",2021-08-03,"south korea looks to fintech as household debt balloons to 16tn"
"590",2021-08-03,"indian shares hit record highs on tech, consumer stocks boost"
"591",2021-08-03,"sanofi confirms 32 bln offer to buy us biotech firm translate bio"
"592",2021-08-03,"stocks to watch airtel, rbl bank, tata motors, va tech wabag, dabur, ncc"
"593",2021-08-03,"sensex, nifty hit record highs on tech, consumer stocks boost"
"594",2021-08-03,"sales, tech, electrification trends the week in automotive"
"595",2021-08-02,"skorea stocks end higher on tech boost, upbeat exports data"
"596",2021-08-02,"duke royalty enters financing agreement with creotech"
"597",2021-08-02,"technical view nifty forms hanging man pattern, experts say create long positions if index holds 15,900"
"598",2021-08-02,"technical indicators suggest some caution in small midcap space aditya agarwala of yes securities"
"599",2021-08-02,"wells fargo hires fintech exec as new head of indie advisor business2 min read"
"600",2021-08-02,"wells fargo hires fintech exec as new head of indie advisor business"
"601",2021-08-02,"goldman sachs picks new stocks to buy from tech to health some with over 100 upside"
"602",2021-08-02,"atm networks will have to be reinvented to face the onslaught of technology"
"603",2021-08-02,"edtech firms byjus, unacademy, upgrad to benefit as chinese players tumble"
"604",2021-08-02,"macrotech developers to meet rs 9,000cr property sales target in fy22"
"605",2021-08-02,"bharat biotechs covaxin effective against delta plus variant, says study"
"606",2021-08-02,"iit roorkee launches seven new academic programmes in technology"
"607",2021-08-02,"itcs life sciences and technology centre bags top ranks in patent filings in india"
"608",2021-08-02,"saudi citc pushes for more tech listings on tadawul"
"609",2021-08-02,"the mexicobased fintech that decided to buy a bank"
"610",2021-08-02,"gasleak detecting tech revolutionizes safety, reduces losses"
"611",2021-08-02,"gasleak detecting tech revolutionizes safety, reduces"
"612",2021-08-02,"the shadow of the chip shortage is looming over techs big quarter"
"613",2021-08-01,"tech startup financing hits records as giant funds dwarf venture capitalists"
"614",2021-08-01,"will amazon accept cryptoand other small business tech news"
"615",2021-08-01,"trigyn technologies ltd announcement under regulation 30 lodrnewspaper publication"
"616",2021-08-01,"behind every hero or villain, there is tech support"
"617",2021-08-01,"saudi arabias thinktech talk initiative brings worldwide egaming expertise to the table"
"618",2021-07-31,"big tech earnings sparklednow the shine may be fading5 min read"
"619",2021-07-31,"barrons big tech earnings sparklednow the shine may be fading"
"620",2021-07-31,"barrons this market is sturdier than the tech selloff suggests"
"621",2021-07-31,"big tech earnings sparklednow the shine may be fading"
"622",2021-07-31,"cartrade tech ipo to open on august 9, issue to close on august 11"
"623",2021-07-31,"after beijings restrictions on education industry, india could be the land of opportunities in edtech startups"
"624",2021-07-31,"tech stocks roundup jim cramer disappointed by amazon earnings"
"625",2021-07-31,"80 british firms explore innovation, space and technology investment opportunities in saudi arabia"
"626",2021-07-31,"rakesh jhunjhunwalabacked nazara technologies posts rs 136 crore profit for q1"
"627",2021-07-31,"nazara technologies posts rs 136crore net profit for june quarter"
"628",2021-07-31,"to make bets on bond market more accurate, marketaxess enlists lessons from big tech3 min read"
"629",2021-07-31,"this market is sturdier than the tech selloff suggests3 min read"
"630",2021-07-31,"taking on tech dr timnit gebru exposes the underbelly of performative diversity in the tech industry"
"631",2021-07-31,"this market is sturdier than the tech selloff suggests"
"632",2021-07-31,"infrastructure bills climatechange features face tricky path over money for electric cars"
"633",2021-07-31,"tech exec invests in digital news startup launched by veteran dc journalists"
"634",2021-07-31,"devangshu datta how stupidity trumps technology makes you question the supposed wisdom of crowds"
"635",2021-07-31,"macrotech developers net debt falls 23 in q1 to rs 12,435 crore"
"636",2021-07-31,"how stupidity trumps technology makes you question the supposed wisdom of crowds"
"637",2021-07-31,"ed attaches london hotel in unitech group money laundering case"
"638",2021-07-31,"4ir can help ksa become a global hub for new drone technology"
"639",2021-07-30,"beijing doubles down on tech data and companies listed overseas"
"640",2021-07-30,"china tech stocks set for worst month since global financial crisis"
"641",2021-07-30,"asia report markets weaker as hong kong tech shares fall again"
"642",2021-07-30,"technical view nifty forms shooting star pattern, listless trade expected to continue"
"643",2021-07-30,"here are 2 possible theories which can explain chinas crackdown on edtech companies"
"644",2021-07-30,"garware hitech hits record high as ashish kacholia ups stake by nearly 1"
"645",2021-07-30,"larsen toubro infotech, persistent midcap it stocks that can rise 715"
"646",2021-07-30,"sensex gyrates 376 pts, ends 66 pts down sun pharma zooms 10, tech m 7"
"647",2021-07-30,"tech mahindra surges over 8, hits new high as q1 profit beats estimates"
"648",2021-07-30,"stocks to watch techm, concor, bandhan bank, upl, tatva chintan, tvs motor"
"649",2021-07-30,"tech stocks lead market lower in final trading day of july3 min read"
"650",2021-07-30,"frances top tech tycoon xavier niel hits 10 billion net worth amid plans to take his empire private"
"651",2021-07-30,"barrons tech stocks lead market lower in final trading day of july"
"652",2021-07-30,"weekend reads time to assess big tech earnings and robinhoods ipo"
"653",2021-07-30,"opinion heres how the 6 big tech stocks now rank, from worst to first"
"654",2021-07-30,"opinion big tech is headed for its biggest year yet, and it isnt even close"
"655",2021-07-30,"us stocks under pressure at months end, with amazon disappointment fueling tech selling"
"656",2021-07-30,"tech stocks lead market lower in final trading day of july"
"657",2021-07-30,"big tech dodged pain from apples privacy changes in q2 in hot digital ad market"
"658",2021-07-30,"brokerages upgrade tech mahindra on q1 show, doubledigit growth outlook"
"659",2021-07-30,"apple airtag review now, a smart, techbacked answer to your forgetfulness"
"660",2021-07-30,"venture capital firms turn to india with chinas tech crackdown"
"661",2021-07-30,"panasonics smart home technology is built in india"
"662",2021-07-29,"bulk deals fumistic gaming buys more apollo tricoat shares ashish kacholia ups stake in garware hitech"
"663",2021-07-29,"the best tech stock to buy today is this cybersecurity stalwart"
"664",2021-07-29,"beijing seeks to ease fears on wall street after tech crackdown"
"665",2021-07-29,"sudarshan sukhanitechnical call, trading calls insightssubscribe"
"666",2021-07-29,"power your tradetechnical and commodity callssubscribe"
"667",2021-07-29,"technical view nifty forms small bullish candle, trend expected to remain directionless"
"668",2021-07-29,"tech mahindra q1 results net profit jumps 308 to rs 1,3532 crore constant currency revenue growth at 39"
"669",2021-07-29,"tech mahindra q1 profit jumps 39 yoy to rs 1,353 crore, beats estimates"
"670",2021-07-29,"windlas biotech ipo to open on aug 4 price band set at rs 448460share"
"671",2021-07-29,"tech view these 28 stocks are on the verge of golden cross breakout"
"672",2021-07-29,"tech mahindra q1 net up 392 yoy to rs 1,353 cr, revenues rises 12"
"673",2021-07-29,"occams razor technology disasters and why we refuse to see the elephants in the room"
"674",2021-07-29,"cramer thinks investors should buy this fintech stock on the dip"
"675",2021-07-29,"taiwan to buy hitech recce pods from us to spy on chinese navy"
"676",2021-07-29,"where is the difference between moderation and censorship on tech platforms"
"677",2021-07-29,"tech mahindra q1 net up 392 yoy to rs 1,353 cr, revenue rises 12"
"678",2021-07-29,"we havent had any impact of chip shortage on our business kpit tech chief"
"679",2021-07-29,"from facebook to twitter, big tech sees social commerce driving sales growth"
"680",2021-07-29,"twitter shuts us offices, tech giants in huddle after new cdc rules"
"681",2021-07-29,"saudi arabia plans 15bn technology fund with private investors"
"682",2021-07-28,"china govt targets mobile popups in latest crackdown on tech sector"
"683",2021-07-28,"china tech crackdown why hang seng saw a bloodbath across ecommerce, edtech and other sectors"
"684",2021-07-28,"happiest minds technologies june quarter profit declines by 29"
"685",2021-07-28,"how to manage big tech earnings and dodgy index action"
"686",2021-07-28,"saudi arabia anticipates 1 trillion riyal injection from 4ir technology"
"687",2021-07-28,"gsk and vir biotechnology to supply eu with covid19 treatment"
"688",2021-07-28,"windlas biotech ipo to open on august 4, tano india pe fund to reduce entire stake"
"689",2021-07-28,"technical view nifty forms hammer pattern, further selling pressure seen if index breaks 15,660"
"690",2021-07-28,"moneycontrol pro panorama tech sneezes, indian market catches a cold"
"691",2021-07-28,"crackdown in chinese market to benefit realty, tech firms in india rahul sharma of equity99"
"692",2021-07-28,"will tech mahindra underperform other it giants in q1fy22"
"693",2021-07-28,"analysts see 1623 yoy pat growth, margin contraction for techm in q1"
"694",2021-07-28,"happiest minds technologies ltd outcome of the board meeting held on july 28 2021"
"695",2021-07-28,"are empire strikes back stocks now a better bet than the megacap techs"
"696",2021-07-28,"beijing calls for calm after historic tech stock rout"
"697",2021-07-28,"chinese tech giants are snapping up gaming studios worldwide"
"698",2021-07-28,"elon musk slams apple in brazen technology rivalry"
"699",2021-07-28,"ktu exam 2021 kerala hc allows tech university to continue with exams"
"700",2021-07-28,"resultsfocused exploration technology innovation"
"701",2021-07-28,"another quarter of content and technology acquisitions"
"702",2021-07-28,"china tech selloff slows as investors wait on beijings next move"
"703",2021-07-28,"big tech enjoys massive quarter, chinas regulations spook investors"
"704",2021-07-28,"wall street tech stocks endure worst day since may"
"705",2021-07-28,"chinese tech stocks sink as regulation fears hit tencent"
"706",2021-07-28,"us open stocks head south ahead of q2 tech earnings"
"707",2021-07-28,"asia report markets mixed as chinese tech plays plunge further"
"708",2021-07-28,"trade spotlight what should investors do with nocil, welspun india zensar technologies"
"709",2021-07-28,"creator indias first web portals in 1990s aims to take his tech co public"
"710",2021-07-28,"rossari biotech limited analystsinstitutional investor meetcon call updates"
"711",2021-07-28,"apple floats above china technology crackdown for now"
"712",2021-07-28,"amgen to buy biotech company teneobio in 900 million deal"
"713",2021-07-28,"opinion cody willard chinas techstock crash is making me worried about the us equity market"
"714",2021-07-28,"wechat suspends new user registrations as china cracks down on tech"
"715",2021-07-28,"chinese tech giants are snapping up gaming studios around the world"
"716",2021-07-28,"walmarts latest business selling its ecommerce tech to other retailers"
"717",2021-07-28,"chinese tech stocks extend losses how two traders are approaching the selloff"
"718",2021-07-28,"chinese tech giants are snapping up gaming studios worldwide here are some potential ramifications"
"719",2021-07-28,"how two traders are approaching the selloff in chinese tech stocks"
"720",2021-07-28,"global stocks retreat ahead of fed, tech earnings"
"721",2021-07-28,"stocks finish lower ahead of big tech earnings, nasdaq down 12"
"722",2021-07-28,"logitech stock drops following narrow revenue beat"
"723",2021-07-28,"sbi, axis bank, icici bank, others buy stakes in fintech firm ibbic"
"724",2021-07-28,"kerala hc cancels btech 1st, 3rd semester exams of apj abdul kalam tech university"
"725",2021-07-28,"the biotechnology revolution using nature to fight disease"
"726",2021-07-28,"realme magdart magnetic wireless charging tech, realme flash smartphone to be unveiled soon report"
"727",2021-07-27,"adtech company adtheorent nears 1 billion spac deal to go public"
"728",2021-07-27,"biontech ceo says vaccine is growing less effective4 min read"
"729",2021-07-27,"barrons biontech ceo says vaccine is growing less effective"
"730",2021-07-27,"asian stock higher, but china tech remains under pressure"
"731",2021-07-27,"dow, sp 500 and nasdaq end at records ahead of big tech earnings, fed meeting"
"732",2021-07-27,"biontech ceo says vaccine is growing less effective"
"733",2021-07-27,"a surprising tech company could be next to join the dow"
"734",2021-07-27,"asiapacific stocks mixed china tech stocks in hong kong remain under pressure"
"735",2021-07-27,"schumpeter china offers a masterclass in how to humble big tech, right"
"736",2021-07-27,"stocks end higher as wall street preps for tech earnings and the federal reserve"
"737",2021-07-27,"eye on the outcome meet c vijayakumar, md ceo, hcl technologies"
"738",2021-07-27,"facebook, tech giants to target manifestos, farright militias in database"
"739",2021-07-26,"wall st mostly edges up as investors eye tech earnings, fed meeting"
"740",2021-07-26,"us stockswall st mostly edges up as investors eye tech earnings, fed meeting"
"741",2021-07-26,"china tech stocks slump as regulators apply fresh pressure"
"742",2021-07-26,"cleantech company 374water touts pfaseliminating technology that makes toxic sludge turn to water"
"743",2021-07-26,"latest hightech, handsfree shoes from kizik prague and vegas"
"744",2021-07-26,"this could be the peak of the tech boom heres what to look for"
"745",2021-07-26,"dow, sp 500 head for records as investors await big tech earnings, fed meeting"
"746",2021-07-26,"this tech company is worth almost 500 billion, and could soon join the dow"
"747",2021-07-26,"sp 500 touches record high ahead of megacap tech earnings"
"748",2021-07-26,"hp enterprise stock is rallying its a tech bargain, analyst says"
"749",2021-07-26,"science, technology investment needed for todays health burdens"
"750",2021-07-26,"wall street hovers near record highs before tech earnings, fed meeting"
"751",2021-07-26,"us open stocks mixed ahead of busy week for tech earnings"
"752",2021-07-26,"itv to invest in 25m for minority stake in live tech games"
"753",2021-07-26,"k3 business technology ends first half in line with forecasts"
"754",2021-07-26,"technical view nifty forms bearish candle, experts say focus on stockspecific opportunities"
"755",2021-07-26,"moneycontrol pro panorama the noose is tightening around big tech"
"756",2021-07-26,"china orders tech companies to fix anticompetitive, security issues"
"757",2021-07-26,"covid19 vaccine pioneer biontech plans malaria, tuberculosis shots"
"758",2021-07-26,"dow, sp 500 hover near records as investors await big tech earnings, fed meeting5 min read"
"759",2021-07-26,"dow, sp 500 hover near records as investors await big tech earnings, fed meeting"
"760",2021-07-26,"amid china tension, dow, sp hover near record highs as investors await big tech earnings and fed meeting"
"761",2021-07-26,"biontech says it plans to develop an mrna vaccine to prevent malaria"
"762",2021-07-26,"here are wall streets favorite tech stocks as earnings for the sector begin"
"763",2021-07-26,"hong kongs hang seng index closes more than 4 down as china tech and education shares plunge"
"764",2021-07-26,"sp 500 hovers near a record ahead of megacap tech earnings"
"765",2021-07-26,"passwords will soon be ancient history how new technologies are replacing passwords"
"766",2021-07-26,"trading alibaba and jdcom as china cracks down on tech"
"767",2021-07-26,"stocks trade higher as wall street prepares for tech earnings and the fed"
"768",2021-07-26,"microsoft, facebook, alphabet ranking the megacap tech stocks ahead of earnings"
"769",2021-07-26,"tyme technologies skyrockets on patent claim approval"
"770",2021-07-26,"imd may deploy cuttingedge tech to forecast weather events more accurately"
"771",2021-07-26,"marlborough technology fund to become global innovation fund as it relaunches with broader investment policy"
"772",2021-07-26,"tech, travel and stimulus means us equities have outperformed peers"
"773",2021-07-26,"pifowned elm invests in indian healthtech platform livemint"
"774",2021-07-26,"big tech firms retake market reins with earnings on tap"
"775",2021-07-26,"amazon eyes partnerships with saudi smes, tech startups"
"776",2021-07-26,"science, technology investment needed for todays health"
"777",2021-07-26,"tech company antiterrorism initiative will increase its focus on farright groups"
"778",2021-07-25,"new tech reduces flat construction time to less than a year"
"779",2021-07-25,"wall st week aheadbig tech companies retake market reins with earnings on tap"
"780",2021-07-25,"cigniti technologies ltd announcement under regulation 30 lodrinvestor presentation"
"781",2021-07-25,"zomatos stellar ipo to have positive impact on foodtech firms valuation experts"
"782",2021-07-25,"iykot hitech toolroom ltd revised results for the year ended 31032021"
"783",2021-07-25,"zomatos stellar ipo to have positive impact on foodtech firms valuation"
"784",2021-07-25,"uttarakhand ayurved university recruitment 2021 apply offline for 63 lab technician, helper other posts"
"785",2021-07-25,"facebook is taking on amazonand other small business tech news"
"786",2021-07-25,"opinion computer hacking may never fully go away even with the best new technology and we may not want it to"
"787",2021-07-25,"computer hacking may never fully go away even with the best new technology and we may not want it to"
"788",2021-07-25,"china crackdown on tech firms make hong kong index worlds biggest loser"
"789",2021-07-24,"zen technologies ltd earnings presentation q1 fy 2022"
"790",2021-07-24,"zen technologies ltd announcement under regulation 30 lodrpress release media release"
"791",2021-07-24,"longer gap in pfizerbiontech covid vaccine boosts antibody levels study"
"792",2021-07-24,"here are wall streets favorite big tech stocks as the nasdaq closes in on another milestone3 min read"
"793",2021-07-24,"fintechs to drive ma in saudi banking sector kpmg"
"794",2021-07-24,"startups will suffer from antitrust bills meant to target big tech, vcs charge"
"795",2021-07-24,"amnesty urges moratorium on surveillance technology in pegasus scandal"
"796",2021-07-24,"zen technologies ltd outcome of the board meeting held on 24th july 2021"
"797",2021-07-24,"millions sleep well, walk safely due to technologies like pegasus nso"
"798",2021-07-24,"zomatos stellar stock market debut sets pace for other indian tech listings"
"799",2021-07-24,"big tech companies retake market reins with earnings on tap"
"800",2021-07-24,"zelda skyward sword hd review still refreshingly technical"
"801",2021-07-24,"here are wall streets favorite big tech stocks as the nasdaq closes in on another milestone"
"802",2021-07-24,"paytm files for indias biggest tech ipo on record"
"803",2021-07-24,"more money chases indian tech startups as investors shun chinese names"
"804",2021-07-24,"a look at zomato indias billion dollar tech start up"
"805",2021-07-24,"pfizer and biontech to supply us with 200 million covid shots"
"806",2021-07-24,"tech use against civil society, regime critics, journalists concerning us on pegasus issue"
"807",2021-07-24,"behind every hero or villain, there is tech support"
"808",2021-07-24,"edtech startup testbook now has 18 lakh paid users"
"809",2021-07-24,"startup of the week firnas aero advancing toward modern technology, one drone at a time"
"810",2021-07-24,"new tech and minings future will prospects improve for women"
"811",2021-07-23,"vodafones booming mpesa shines a light on valuable africa fintechs"
"812",2021-07-23,"vela technologies in advanced states of new director appointment"
"813",2021-07-23,"technical view nifty forms doji candle, traders advised to stay neutral"
"814",2021-07-23,"peraton taps former booz allen cio to lead tech integration2 min read"
"815",2021-07-23,"big tech ad company stocks surge heres why3 min read"
"816",2021-07-23,"8 industry experts on the focus of tech startups theyd invest in themselves"
"817",2021-07-23,"is artificial intelligence the new logistics technology for organ transportation"
"818",2021-07-23,"half of us states use facial recognition tech to vet unemployment claims"
"819",2021-07-23,"hacked us tech firm secures tool to restore services"
"820",2021-07-23,"tech stocks roundup jim cramer says faang is key to gauging the market"
"821",2021-07-23,"bharat biotech axes covid vaccine deal with brazils precisa statement"
"822",2021-07-23,"bharat biotech terminates covaxin deal with brazils precisa"
"823",2021-07-23,"vergecast jeff bezos in space, rcs on verizon, and biden on big tech"
"824",2021-07-23,"markets in new era with domestic listing of tech startups sebi chairman ajay tyagi"
"825",2021-07-23,"what should investors do with ultratech cement post q1 earnings buy, sell or hold"
"826",2021-07-23,"lt infotech why this is the right pick for growthhungry investors"
"827",2021-07-23,"zomatos 13 bn ipo to test appetite for indias new tech generation"
"828",2021-07-23,"happiest minds technologies ltd announcement under regulation 30 lodrpress release media release"
"829",2021-07-23,"asiapacific stocks slip as china tech shares fall amid regulatory fears"
"830",2021-07-23,"tech stocks lead nasdaq to third straight day of gains"
"831",2021-07-23,"kaseya, the tech firm hit by ransomware, gets the key to unlock its customers data"
"832",2021-07-23,"billionaires conquer the final frontier the week in tech"
"833",2021-07-22,"wall street stocks climb for third day as big tech advances"
"834",2021-07-22,"ubers freight unit to buy logistics tech firm transplace for 225 billion3 min read"
"835",2021-07-22,"dell technologies shares environmental sustainability report card"
"836",2021-07-22,"dow rises slightly for a third day led by tech stocks as markets shrug off poor jobs data"
"837",2021-07-22,"websites of airlines, banks, tech firms recover from brief global outage"
"838",2021-07-22,"indians more vulnerable to tech support scams, says microsoft report"
"839",2021-07-22,"valves steam deck technically lets you swap the ssd, targets 30fps gameplay"
"840",2021-07-22,"it, financial stocks lift sensex 639 pts nifty50 at 15,824 techm surges 6, airtel 4"
"841",2021-07-22,"director dealings puretech health director raises stake"
"842",2021-07-22,"technical view nifty bounces back to form bullish candle 15,950 a critical hurdle"
"843",2021-07-22,"ultratech cement q1 results beat estimates, profit more than doubles to rs 1,700 crore"
"844",2021-07-22,"sebi chief hails home listing of tech cos, says markets entering new era"
"845",2021-07-22,"sc agrotech ltd shareholding for the period ended june 30 2021"
"846",2021-07-22,"ubers freight unit to buy logistics tech firm transplace for 225 billion2 min read"
"847",2021-07-22,"the door is closing on chinese tech ipos on wall street"
"848",2021-07-22,"facebooks in a great place why one fund manager thinks tech stocks are a buy"
"849",2021-07-22,"british fintech boss sounds the alarm about dangers of bitcoin and other cryptocurrencies"
"850",2021-07-22,"visa makes another big bet on fintech, buying uk payments startup currencycloud"
"851",2021-07-22,"spyware for sale the booming trade in surveillance tech"
"852",2021-07-22,"tech view how to trade paint stocks amid drop in crude oil prices"
"853",2021-07-22,"us banks need better approach to fintech, says exgoldman executive"
"854",2021-07-22,"technical charts show trend reversal in nifty, range may now shift to 15,70015,500"
"855",2021-07-22,"cios scouting for tech talent keep eye on wage inflation3 min read"
